"X","misinformation","user_location","user_description","user_followers","user_friends","user_favourites","user_verified","date","text","hashtags","polarity_text","subjectivity_text","polarity_description","subjectivity_description","cleaned_text","entities","Organizations","Locations","Symptoms","COVID","Vaccination","Politics","Conspiracy","Slurs","Masks","Miscellaneous","origin","vaccine_conspiracy","government","pharma","Five_G","gates","nwo","media"
69296,0.0328900377859782,"Bangkok, Thailand","Whatever is here, is found elsewhere. But what is not here, is nowhere else. || Full Stack Developer",421,605,2767,"False",2020-11-08,"Ok, it's official now. We have a vaccine for Covid-19 finally #CovidVaccine
https://t.co/PMRBJNoTtc","['CovidVaccine']",0.25,0.75,0.35,0.55,"Ok its official now We have a vaccine for Covid19 finally CovidVaccine
","['covid19', 'covidvaccine']",0,0,0,1,1,0,0,0,0,0,0,0,0,0,0,0,0,0
69397,0.0649270307981385,"","Fight for what you want 👊",6,20,56,"False",2020-11-08,"What if everyone die in a year or half due to side effects of CoVID vaccine 🙄🙄😅😅🤧.....???

#CovidVaccine… https://t.co/07iL37HRAN","['CovidVaccine']",-0.145833333333333,0.270833333333333,0,0,"What if everyone die in a year or half due to side effects of CoVID vaccine 

CovidVaccine ","['covid', 'covidvaccine']",0,0,0,1,1,0,0,0,0,0,0,0,0,0,0,0,0,0
69523,0.34155326957133,"","NWP 
Poetry blog at https://t.co/Bctl2lVVE2",240,315,1316,"False",2020-10-09,"#TheNurembergCode #Covid_19
#CovidVaccine #DNA_RNA 
We have a personal responsibility that may not be delegated.  K… https://t.co/S6cmHOiSAg","['TheNurembergCode', 'Covid_19', 'CovidVaccine', 'DNA_RNA']",0,0.3,0,0,"TheNurembergCode Covid19
CovidVaccine DNARNA 
We have a personal responsibility that may not be delegated  K ","['covid19 covidvaccine']",0,0,0,0,0,0,0,0,0,0,0,0,0,0,0,0,0,0
69616,0.0565900087367888,"Farrukhabad","I don't want to be the next anyone.. I'm the first Anoop........ANOOP YADAV",38,92,491,"False",2020-11-08,"I know its been Called SPUDnik however I wish it doesn't turn out to be doodie in the end!!(Say'n """"come on who are… https://t.co/Oh766kZxN1","[]",0,0,0.125,0.166666666666667,"I know its been Called SPUDnik however I wish it doesnt turn out to be doodie in the endSayn come on who are ","['spudnik', 'endsayn']",0,0,0,0,0,0,0,0,0,0,0,0,0,0,0,0,0,0
69683,2.22044604925031e-16,"Gujarat, India","NO.1 GUJARATI NEWS CHANNEL. Follow us for breaking news and updates from Gujarat and India. For latest News Videos Subscribe https://t.co/qgmqtapacW",538343,169,21,"True",2020-10-13,"Johnson &amp; Johnson pauses Covid vaccine trial as participant falls ill

#COVID19 #CovidVaccine #TV9News https://t.co/HQMmZzE7yN","['COVID19', 'CovidVaccine', 'TV9News']",-0.5,1,0.5,0.9,"Johnson amp Johnson pauses Covid vaccine trial as participant falls ill

COVID19 CovidVaccine TV9News ","['johnson', 'johnson', 'covid', 'covid19']",0,0,0,2,0,2,0,0,0,0,0,0,0,0,0,0,0,0
69892,0.0227851387508432,"Bengaluru, India","Creative Lead - Asianet News | Storyteller | Explorer | Third-Eye Opener | Nature Worshipper | Gooner for Life | Tweets & RTs Personal",2832,1842,3082,"False",2020-11-08,"@desimojito Question though is - will #Russia share it with rest of the world soon? #CovidVaccine","['Russia', 'CovidVaccine']",0,0,0.25,0.65,"desimojito Question though is  will Russia share it with rest of the world soon CovidVaccine","['russia', 'covidvaccine']",0,1,0,0,1,0,0,0,0,0,0,0,0,0,0,0,0,0
70111,0.103880611946734,"Washington DC area","Writer/journalist specializing in medicine/health. Living with type 1 diabetes since 1973.",9848,6479,8426,"False",2020-10-09,"I'm looking forward to this. #covid19 #CovidVaccine https://t.co/RB6sxwZOAn","['covid19', 'CovidVaccine']",0,0,0,0,"Im looking forward to this covid19 CovidVaccine ","['covidvaccine']",0,0,0,0,1,0,0,0,0,0,0,0,0,0,0,0,0,0
70467,0.0638787982735242,"","A cacophony of lies and an orgy of censorship. Learn how the COVID-19 'pandemic' is an illusion, designed to enslave you.",305,1830,958,"False",2020-10-09,"Pro-paedophilia, sexual exploiters of children, @netflix #Netflix awaiting #CovidVaccine before allowing staff to r… https://t.co/Pa7XkflcSN","['Netflix', 'CovidVaccine']",0.5,0.833333333333333,0,0,"Propaedophilia sexual exploiters of children netflix Netflix awaiting CovidVaccine before allowing staff to r ","['propaedophilia', 'covidvaccine']",0,0,0,0,1,0,0,0,0,0,0,0,0,0,0,0,0,0
70505,0.0582208257846378,"WALES/CYMRU","Hollowhoax Denier - Germ Theory Disbeliever - Vax Dodger - NWO Opposer",930,1523,24212,"False",2020-10-09,"Govt. seeking feedback about the #CovidVaccine: consulation open til Fri 18th Sept. We need to tell them they are w… https://t.co/GwZRJXrkjC","['CovidVaccine']",0,0.5,0,0,"Govt seeking feedback about the CovidVaccine consulation open til Fri 18th Sept We need to tell them they are w ","['covidvaccine']",0,0,0,0,1,0,0,0,0,0,0,0,0,0,0,0,0,0
70685,0.00839780336209704,"Bhubaneshwar, India","If something on Odisha is not on https://t.co/tklvVwUTgF, it is unlikely to be elsewhere...

Join us on Telegram:  https://t.co/Hu7tZ0QKiH
Follow us on Facebook: https://t.co/EYZelyrCNf",548892,283,414,"True",2020-11-08,"Russia announces 'world's first' COVID-19 vaccine, Putin's daughter inoculated

#Russia #RussianVaccine… https://t.co/vIqeEK1wWm","['Russia', 'RussianVaccine']",0.25,0.333333333333333,-0.5,0.5,"Russia announces worlds first COVID19 vaccine Putins daughter inoculated

Russia RussianVaccine ","['russia', 'covid19', 'putins', 'russia']",0,2,0,1,0,0,0,0,0,0,0,0,0,0,0,0,0,0
70809,0.0206227624699177,"Silicon Valley, CA","Oigetit (Oh, I get it) filters Fake News. Try the Oigetit app here: For iPhone: https://t.co/uu0YddV5Dr & for Android cells: https://t.co/YlARgLz7py",922,893,1029,"False",2020-10-20,"California won't allow any distribution of new coronavirus vaccines in the nation's most populous state until it is… https://t.co/vwJoH0k42N","[]",0.318181818181818,0.477272727272727,-0.5,1,"California wont allow any distribution of new coronavirus vaccines in the nations most populous state until it is ","['california']",0,1,0,0,0,0,0,0,0,0,0,0,0,0,0,0,0,0
71138,0.0839298581988235,"Ulaanbaatar","Infinite consciousness having a human experience. “The higher we soar, the smaller we appear to those who cannot fly” #anonymous #CloversForAssange🍀",416,515,20913,"False",2020-11-08,"This nanochip technology can reprogram human cells #CovidVaccineRace #CovidVaccine 
https://t.co/L3du3kHJBH","['CovidVaccineRace', 'CovidVaccine']",0,0.1,0.2625,0.5,"This nanochip technology can reprogram human cells CovidVaccineRace CovidVaccine 
","['covidvaccinerace']",0,0,0,0,0,0,0,0,0,0,0,0,0,0,0,0,0,0
71155,0.0415054886619792,"Anantapur","Bharatiya Engineering Science and Technology Innovation University , Anantapur, Andhra Pradesh 
Established under  Act 6 of 2019 , Govt of AP",168,13,145,"False",2020-10-15,"BESTIU is organizing an online interactive session to discuss the after-effects of the Pandemic and the current sta… https://t.co/axO57I4wmr","[]",0,0.4,0,0,"BESTIU is organizing an online interactive session to discuss the aftereffects of the Pandemic and the current sta ","['bestiu', 'pandemic']",0,0,0,0,0,0,0,0,0,0,0,0,0,0,0,0,0,0
71220,0.125836566847101,"World","A big heart & An open mind",124,215,1428,"False",2020-11-08,"Is @adarpoonawalla listening? 
Could you please coordinate with Russian Embassy?
 #CovidVaccine","['CovidVaccine']",0,0,0,0.3,"Is adarpoonawalla listening 
Could you please coordinate with Russian Embassy
 CovidVaccine","['russian', 'embassy']",0,0,0,0,0,0,0,0,0,0,0,0,0,0,0,0,0,0
71271,0.0448683315097775,"India","Decode Indian Politics. Write for #PulseIndia. Email us at connect@the-pulse.in

Check Impulse - Our Daily Cartoon - #ImpulseCartoon",2379,268,757,"False",2020-10-19,"WHO Chief Scientist Soumya Swaminathan believes that a vaccine against the coronavirus disease will be ready for re… https://t.co/e5yGoMGYzV","[]",0.2,0.5,0,0,"WHO Chief Scientist Soumya Swaminathan believes that a vaccine against the coronavirus disease will be ready for re ","['scientist soumya swaminathan']",0,0,0,0,0,0,0,0,0,0,0,0,0,0,0,0,0,0
71272,0.00361577427325556,"Italia","Trollo o son desto?",6963,2254,13910,"False",2020-11-08,"@EUCouncil EU regime is the first #fakenews creator! Always attacking #Russia only because they're jealous of their… https://t.co/YtoOjArHS9","['fakenews', 'Russia']",0.15625,0.666666666666667,0,0,"EUCouncil EU regime is the first fakenews creator Always attacking Russia only because theyre jealous of their ","['eucouncil', 'eu', 'russia']",0,2,0,0,0,0,0,0,0,0,0,0,0,0,0,0,0,0
71336,0.0567658580095508,"","Chai lover. News addict. Sportspersons inspire me. Views personal, RTs not endrosements",172,709,1870,"False",2020-10-22,"So a person who didn't receive the vaccine dies and headlines omit this major detail. Why? Clickbait? #CovidVaccine","['CovidVaccine']",0.0625,0.5,0,0.3,"So a person who didnt receive the vaccine dies and headlines omit this major detail Why Clickbait CovidVaccine","['clickbait', 'covidvaccine']",0,0,0,0,1,0,0,0,0,0,0,0,0,0,0,0,0,0
71445,0.0794635681046213,"USA","TruthArtGallery speaks to topics of: Controversy - False Flag  -Social Issues - Editorial - Surrealism - NO 5G  - Virtual art gallery - Submit art at URL. 🎨",646,1346,3745,"False",2020-10-17,"@scucina @YouTube https://t.co/5hQlRqlFSD  
W.H.O. Flips on Lockdown; ‘MASK’ERADE Exposed by CDC?; Dr. Bartlett’s… https://t.co/aPpzV65TRB","[]",0,0,-0.183333333333333,0.333333333333333,"scucina YouTube   
WHO Flips on Lockdown MASKERADE Exposed by CDC Dr Bartletts ","['youtube', 'lockdown maskerade', 'cdc']",1,0,0,0,0,0,0,0,0,0,0,0,0,0,0,0,0,0
71566,0.0342626734204066,"","foodie,medico,football lover fan of @iamsrk and #leomessi",989,779,74685,"False",2020-11-08,"Russia launches first  #CovidVaccine.
You are happy ki ab college jaake padhai karenge,
I am happy ki ab hostel jaa… https://t.co/zmKuIuNna5","['CovidVaccine']",0.616666666666667,0.777777777777778,0,0,"Russia launches first  CovidVaccine
You are happy ki ab college jaake padhai karenge
I am happy ki ab hostel jaa ","['russia']",0,1,0,0,0,0,0,0,0,0,0,0,0,0,0,0,0,0
71764,0.0318862184471459,"calicut university","മലയാളി❤️/പ്രവാസി❤️/മലപ്പുറത്തുകാരൻ/❤️ 100%ഫോളോബാക്ക്❤️",3234,3993,27126,"False",2020-11-08,"not only to our country, but to the whole world. Once the Soviet satellite paved the way for humanity into space, n… https://t.co/1yG0vOnePf","[]",0.1,0.7,0,0,"not only to our country but to the whole world Once the Soviet satellite paved the way for humanity into space n ","['soviet']",0,0,0,0,0,0,0,0,0,0,0,0,0,0,0,0,0,0
71768,0.101072783642584,"Washington, DC","Cook Organic, Not the Planet! Political Director @RegenerateUS @OrganicConsumer / Farmers & Ranchers for the #GreenNewDeal podcast host @Regeneration_In",1247,4055,3348,"False",2020-10-20,"When #CovidVaccine contractor @emergentbiosolu was known as BioPort, they caused #GulfWarSyndrome with the anthrax… https://t.co/Rp47JYaFCS","['CovidVaccine', 'GulfWarSyndrome']",0,0,0,0.1,"When CovidVaccine contractor emergentbiosolu was known as BioPort they caused GulfWarSyndrome with the anthrax ","['covidvaccine', 'bioport', 'gulfwarsyndrome']",0,0,0,0,1,0,0,0,0,0,0,0,0,0,0,0,0,0
71819,0.0238980494967051,"Liverpool, United Kingdom ","NeedleSmart is a globally unique, patented product range that destroys contaminated medical sharp waste at the point of use.",710,2058,7717,"False",2020-10-14,"Tracking patients’ COVID-19 vaccinations likely to challenge providers long after vaccines arrive | @modrnhealthcr… https://t.co/FFSBDo40oH","[]",-0.025,0.7,0.0125,0.4375,"Tracking patients COVID19 vaccinations likely to challenge providers long after vaccines arrive  modrnhealthcr ","['covid19']",0,0,0,1,0,0,0,0,0,0,0,0,0,0,0,0,0,0
72089,0.0415669133080108,"#Orwell1984, USA","'If there was hope, it MUST lie in the proles, b/c only there in those swarming disregarded masses..could the force 2 destroy the Party ever be generated.1984",1061,3832,52355,"False",2020-10-15,"According to Forbes’s estimates, #BillGates private wealth, estimated at around $115 billion, has increased by more… https://t.co/6oeIGIOfft","['BillGates']",0,0.375,-0.1,0.5,"According to Forbess estimates BillGates private wealth estimated at around 115 billion has increased by more ","['forbess', 'billgates']",0,0,0,0,0,0,1,0,0,0,0,0,0,0,0,0,0,0
72117,0.0223984075646988,"India","National Hindi News Channel, Covers News in Politics, Sports, Business & Cinema. RT not endorsement. Email : Corporate@jk24x7news.tv",23309,4,1812,"False",2020-11-08,"Russia becomes first country to register COVID-19 vaccine #COVID #COVID19 #CovidVaccine #Russia https://t.co/el02ErSrNS","['COVID', 'COVID19', 'CovidVaccine', 'Russia']",0.25,0.333333333333333,0,0,"Russia becomes first country to register COVID19 vaccine COVID COVID19 CovidVaccine Russia ","['russia', 'covid19', 'covid', 'russia']",0,2,0,2,0,0,0,0,0,0,0,0,0,0,0,0,0,0
72156,0.035754439924536,"New Delhi, India","Health Communicator, BCC & Health Awareness Expert, IT Innovation Planner for E-gov, Passionate Facilitator/ Contributor to add quality to 'Patient Journey'",210,514,229,"False",2020-10-19,"It is really simple. Wearing a mask is a must; violators are Rakshasas. Do you want to be a Rakshasa this Navratri?… https://t.co/dhnPwsDWBJ","[]",0,0.357142857142857,-0.05,0.85,"It is really simple Wearing a mask is a must violators are Rakshasas Do you want to be a Rakshasa this Navratri ","['rakshasas do']",0,0,0,0,0,0,0,0,0,0,0,0,0,0,0,0,0,0
72296,0.0828377242163793,"Kalyan  Maharashtra India","Avid reader, I discuss movie , sports  , education systems, Mobile No:8433548568",15,33,1689,"False",2020-10-22,"BJP, please let us know when will be we people's of Maharashtra's turn, we should have to wait for 4yrs?

#CovidVaccine","['CovidVaccine']",0,0,0.25,1,"BJP please let us know when will be we peoples of Maharashtras turn we should have to wait for 4yrs

CovidVaccine","['bjp', 'maharashtras']",0,0,0,0,0,0,0,0,0,0,0,0,0,0,0,0,0,0
72392,0.219558300786135,"Mumbai, India","Bade Bade desho mein *esi* choti choti baatein hoti rehti hai!",12,91,156,"False",2020-11-08,"Putin after world asks for the vaccine😂
#RussianVaccine #CovidVaccine #COVID19 https://t.co/T1PekEas6Z","['RussianVaccine', 'CovidVaccine', 'COVID19']",0,0,0,0,"Putin after world asks for the vaccine
RussianVaccine CovidVaccine COVID19 ","['putin', 'russianvaccine']",0,0,0,0,0,0,0,0,0,0,0,0,0,0,0,0,0,0
72814,0.0254720457280855,"richmond va","mother, sister, hearing angel. i'm saving hearing lives..one at a time. never trumper..resister...single payer health care is what we need!",56,726,529,"False",2020-10-20,"I am participating in the Phizer stage 2/3 covid vaccine trial. Had my first injection today. #CovidVaccine  #coronavirus","['CovidVaccine', 'coronavirus']",0.25,0.333333333333333,0,0,"I am participating in the Phizer stage 23 covid vaccine trial Had my first injection today CovidVaccine  coronavirus","['phizer', 'covidvaccine']",0,0,0,0,1,0,0,0,0,0,0,0,0,0,0,0,0,0
72817,0.0143369275711137,"","Proud European 🕷🕷🕷",3868,4321,525543,"False",2020-10-20,"@EnglishmanAdam Everyone. The rich will pay to go private anyway, the morons will refuse to vaccinate, the rest of… https://t.co/fxlwGoLZMu","[]",-0.141666666666667,0.708333333333333,0.4,0.5,"EnglishmanAdam Everyone The rich will pay to go private anyway the morons will refuse to vaccinate the rest of ","['englishmanadam']",0,0,0,0,0,0,0,0,0,0,0,0,0,0,0,0,0,0
72941,1.86166970689508e-09,"","Actor Fan page ............Parody Account ......................user Rashmi khatri

 Be indian.......   🇮🇳🇮🇳🇮🇳🇮🇳🇮🇳🇮🇳🇮🇳🇮🇳🇮🇳🇮🇳",24131,13084,19610,"False",2020-11-08,"#CovidVaccin

Breaking 
Putin announced that Russia approved a COVID-19 vaccine — and gave it to his daughter… https://t.co/DMz0r17xcY","['CovidVaccin']",0,0,0,0,"CovidVaccin

Breaking 
Putin announced that Russia approved a COVID19 vaccine  and gave it to his daughter ","['covidvaccin', 'putin', 'russia', 'covid19']",0,1,0,1,0,0,0,0,0,0,0,0,0,0,0,0,0,0
72993,0.0989595396536699,"aurangabad,maharashtra","Activist,मनसे सचिव पैठण
social activists
anti vaxer
vaccine truth
GMO seed is poisonous 5G EMF kills",384,51,1510,"False",2020-10-09,"Why not you comment are not taking responsibility if there will be any side effects of #CovidVaccine after of your… https://t.co/u9oqYzVYEB","['CovidVaccine']",0,0,0.0333333333333333,0.0666666666666667,"Why not you comment are not taking responsibility if there will be any side effects of CovidVaccine after of your ","['covidvaccine']",0,0,0,0,1,0,0,0,0,0,0,0,0,0,0,0,0,0
73167,0.056283682203221,"Montrose, Houston TX","Vaccine Scientist-Pediatrician-Author, Prof Dean @BCM_TropMed @TexasChildrens, Univ Prof @Baylor, Hagler Inst Advanced Study @TAMU, Founding Editor @PLOSNTDs",97290,1992,17880,"True",2020-10-15,"Many thanks ⁦@chrislhayes⁩ for hosting me ⁦@allinwithchris⁩ I spoke about the complexities of #CovidVaccine roll ou… https://t.co/1lwFs1IF2f","['CovidVaccine']",0.35,0.35,0.4,0.6,"Many thanks chrislhayes for hosting me allinwithchris I spoke about the complexities of CovidVaccine roll ou ","['covidvaccine']",0,0,0,0,1,0,0,0,0,0,0,0,0,0,0,0,0,0
73206,0.043022381563957,"Guwahati, India","Founding Editor of the P.E.O.P.L.E Assam. Filmmaker & Photographer. I write, too. RTs are not necessarily my views.",1122,54,419,"False",2020-11-08,"#UPDATE: Putin names the #RussianVaccine as ‘Sputnik’.

👉🏼 Sputnik was a Soviet Satellite.

👉🏼 The ‘first’… https://t.co/f4FFomjcQd","['UPDATE', 'RussianVaccine']",0.25,0.333333333333333,0,1,"UPDATE Putin names the RussianVaccine as Sputnik

 Sputnik was a Soviet Satellite

 The first ","['update', 'putin', 'russianvaccine', 'sputnik sputnik', 'soviet']",0,0,0,0,0,0,0,0,0,0,0,0,0,0,0,0,0,0
73354,0.00867261874287963,"Jaipur, India","Welcome to the Official Twitter page of First India Newspaper. Follow us for the latest updates. #FirstIndia",6180,208,98,"False",2020-10-22,"The Government of India has announced the delivery of the #CovidVaccine.

To know when you will get a #vaccine and… https://t.co/GmytxxEa5U","['CovidVaccine', 'vaccine']",0,0,0.516666666666667,0.711111111111111,"The Government of India has announced the delivery of the CovidVaccine

To know when you will get a vaccine and ","['india', 'covidvaccine']",0,1,0,0,1,0,0,0,0,0,0,0,0,0,0,0,0,0
73423,0.0937885560199956,"Nigeria","Inspired to be Just.
Do not commit injustice, because injustice is darkness in the Day of Judgment.
Prophet Muhammad (PBUH) Prophet of justice and mercy❤️",59,353,3683,"False",2020-11-08,"@realDonaldTrump @POTUS Russia, #CovidVaccine is now ready for use","['CovidVaccine']",0.2,0.5,0,0,"realDonaldTrump POTUS Russia CovidVaccine is now ready for use","['realdonaldtrump', 'potus russia']",0,0,0,0,0,0,0,0,0,0,0,0,0,0,0,0,0,0
73433,0.0852247528551423,"विश्वगरु भारत","इतिहास टकराने वालो की लिखी जाती हैं।💪
तलवे चाटने वालो की नहीं
      🙏🙏जय श्री राम🙏🙏",732,785,999,"False",2020-11-08,"Technically the world’s first #CovidVaccine is ready ! #RussianVaccine","['CovidVaccine', 'RussianVaccine']",0.166666666666667,0.311111111111111,0,0,"Technically the worlds first CovidVaccine is ready  RussianVaccine","['covidvaccine']",0,0,0,0,1,0,0,0,0,0,0,0,0,0,0,0,0,0
73551,0.0249073877946111,"Nagaland, India","Social entrepreneur | Recipient, National Tourism Award for Innovation using IT | RTs are not endorsements",1715,309,126,"False",2020-11-08,"Fantastic! #Russia #CovidVaccine https://t.co/0SqRARrSaG","['Russia', 'CovidVaccine']",0.5,0.9,0.0333333333333333,0.0666666666666667,"Fantastic Russia CovidVaccine ","['fantastic', 'russia']",0,1,0,0,0,0,0,0,0,0,0,0,0,0,0,0,0,0
73677,0.0305842569960642,"Everywhere","GIDITRAFFIC -Lending Each Other An Eye-  #TrafficUpdates #CityScout #GIDITRAFFIC #GiditrafficTv #InformationHub  info@giditraffic.com",1696360,5810,15291,"True",2020-11-08,"“@FELASTORY: Congratulations 🥳 to Russia 🇷🇺 for the first #CovidVaccine. ⁦@Gidi_Traffic⁩ https://t.co/JsJyrxwDSl","['CovidVaccine']",0.25,0.333333333333333,-0.125,0.375,"FELASTORY Congratulations  to Russia  for the first CovidVaccine GidiTraffic ","['felastory congratulations', 'russia', 'covidvaccine']",0,1,0,0,1,0,0,0,0,0,0,0,0,0,0,0,0,0
73703,0.017913878233978,"Dallas, TX","☯ Doctorpreneur @ https://t.co/6jiuRebwvC | An Independent returning to the party of my ancestors:  Republican. #GreatAwakening #MAGA2020 #BlackVoicesForTrump",111,589,1794,"False",2020-11-08,"@CRRJA5 PETITION:  No to mandatory vaccination for the #coronavirus

#VaccineMandate #MandatoryVaccine… https://t.co/lnWjqsJlCP","['coronavirus', 'VaccineMandate', 'MandatoryVaccine']",0,0,0,0.125,"CRRJA5 PETITION  No to mandatory vaccination for the coronavirus

VaccineMandate MandatoryVaccine ","['crrja5', 'petition no', 'vaccinemandate']",0,0,0,0,0,0,0,0,0,0,0,0,0,0,0,0,0,0
73999,0.0520480407043085,"","''Then the LION (now wolf) shall lay down with the Lamb...'' Isaiah 11:6
The Bible is changing supernaturally.
Jesus is my Lord and Savior.  ISFP(Myers Briggs)",207,322,3802,"False",2020-10-14,"See how genuine they are and how much they study the vaccine and it's effects and care? plus they even tell us when… https://t.co/6krY19gCju","[]",0.3,0.35,0.0055555555555555,0.427777777777778,"See how genuine they are and how much they study the vaccine and its effects and care plus they even tell us when ","[]",0,0,0,0,0,0,0,0,0,0,0,0,0,0,0,0,0,0
74221,0.0349285249719309,"","Let’s rebuild our newly independent country and make it even Greater Britain.. Always follows back. #brexit #nhs #alllivesmatter #DefundTheBBC",3062,4965,3684,"False",2020-10-22,"Oxford vaccine works! Coronavirus vaccine breakthrough as Oxford University scientists given positive news… https://t.co/0LraGDEoDm","[]",0.227272727272727,0.545454545454545,0.166666666666667,0.208333333333333,"Oxford vaccine works Coronavirus vaccine breakthrough as Oxford University scientists given positive news ","['oxford', 'coronavirus', 'oxford university']",0,0,0,0,0,0,0,0,0,0,0,0,0,0,0,0,0,0
74238,0.123399415206198,"Bengaluru, India","Journalist @Oneindia | Photographer | Reader.",986,1048,4539,"False",2020-11-08,"Putin's which daughter got the vaccine?
Is it Mariya Putina or Yekaterina Putina?
#CovidVaccineRace #COVID19vaccine #CovidVaccine","['CovidVaccineRace', 'COVID19vaccine', 'CovidVaccine']",0,0,0,0,"Putins which daughter got the vaccine
Is it Mariya Putina or Yekaterina Putina
CovidVaccineRace COVID19vaccine CovidVaccine","['mariya putina', 'yekaterina putina']",0,0,0,0,0,0,0,0,0,0,0,0,0,0,0,0,0,0
74392,9.19355151384332e-09,"New Delhi","Breaking news alerts from India.",593,37,88,"False",2020-10-13,"Johnson &amp; Johnson Pauses COVID-19 Vaccine Trial Participant Became Unwell

#johnsonandjohnson #COVID19… https://t.co/QM2i98XtzS","['johnsonandjohnson', 'COVID19']",0,0,0,0,"Johnson amp Johnson Pauses COVID19 Vaccine Trial Participant Became Unwell

johnsonandjohnson COVID19 ","['johnson', 'johnson pauses', 'covid19 vaccine trial participant became unwell', 'covid19']",0,0,0,1,0,1,0,0,0,0,0,0,0,0,0,0,0,0
74403,0.0533278773090669,"","Journalist @Sambad
District Correspondent",111,476,845,"False",2020-11-08,"Revolutionary Step By The Russian President, Vaccinates His Own Daughter Before Launching It For Public #Russia… https://t.co/KPhBKuJha5","['Russia']",0.2,0.355555555555556,0,0,"Revolutionary Step By The Russian President Vaccinates His Own Daughter Before Launching It For Public Russia ","['russian', 'vaccinates', 'public russia']",0,0,0,0,0,0,0,0,0,0,0,0,0,0,0,0,0,0
74724,0.070392505576378,"Mumbai, Delhi & Kanpur","Political Enthusiast▪️Strategist▪️Member of @ProfCong, @INCIndia  #Professionals4Progress #ProudIndian🇮🇳 ~ views are personal▪️Follow, RT x Endorsement",7970,134,25647,"False",2020-10-22,"Is the promise of free COVID vaccine same as the 15 lakh promised to the nation in 2014? 

#CovidVaccine
#BiharElections","['CovidVaccine', 'BiharElections']",0.2,0.4625,0,0.1,"Is the promise of free COVID vaccine same as the 15 lakh promised to the nation in 2014 

CovidVaccine
BiharElections","['covid', 'covidvaccine']",0,0,0,1,1,0,0,0,0,0,0,0,0,0,0,0,0,0
74797,0.0632290962363832,"United States","The Web's premier independent news source for compliance, risk and ethics.",14946,7417,1546,"False",2020-10-09,"It's not too soon to talk about whether employers can make COVID vaccinations a requirement in order to return to w… https://t.co/BvEPyPOBAS","[]",0,0,0,0.125,"Its not too soon to talk about whether employers can make COVID vaccinations a requirement in order to return to w ","['covid']",0,0,0,1,0,0,0,0,0,0,0,0,0,0,0,0,0,0
74823,0.172723943094839,"","Being imperfect emphasizes our dependence on God’s mercy. 🇻🇦 ",397,2615,8633,"False",2020-11-08,"I dont care who created the vaccine as long as it is safe and effective! #CovidVaccineRace #CovidVaccine #COVID19… https://t.co/UJ5h0iP2tI","['CovidVaccineRace', 'CovidVaccine', 'COVID19']",0.4,0.566666666666667,0,0,"I dont care who created the vaccine as long as it is safe and effective CovidVaccineRace CovidVaccine COVID19 ","['covidvaccinerace']",0,0,0,0,0,0,0,0,0,0,0,0,0,0,0,0,0,0
