"X","misinformation","dominant_topic","user_location","user_description","user_followers","user_friends","user_favourites","user_verified","date","text","hashtags","polarity_text","subjectivity_text","polarity_description","subjectivity_description","cleaned_text","entities","Organizations","Locations","Symptoms","COVID","Vaccination","Politics","Conspiracy","Slurs","Masks","Miscellaneous","origin","vaccine_conspiracy","government","pharma","Five_G","gates","nwo","media","year","month","day","day_of_week"
19648,0.137194320054574,"Government Response","Baltimore, MD","mission Johns Hopkins Center Immunization Research facilitate development new infectious diseases global importance .",350,212,2210,"False",2020-11-03,"Early approval # could stymie hunt better ones # ","['COVID19', 'CovidVaccine']",0.3,0.4,0.01212121,0.1848485,"Early approval  could stymie hunt better ones  ","['early']",0,0,0,0,0,0,0,0,0,0,0,0,0,0,0,0,0,0,2020,11,3,"Tue"
19808,0.143354396470519,"Gratitude and Optimism","","❤️🇺🇸❤️🇺🇸MAGA",132,553,3414,"False",2020-10-13,"Please share- part 2 . Part 1 . @ DrBenTapper1 # # WakeUp # Trump2020 @ realDonaldTrump ","['CovidVaccine', 'WakeUp', 'Trump2020']",0,0,0,0,"Please share part 2  Part 1   DrBenTapper1   WakeUp  Trump2020  realDonaldTrump ","['please', 'drbentapper1']",0,0,0,0,0,0,0,0,0,1,0,0,0,0,0,0,0,0,2020,10,13,"Tue"
19858,0.14022043393149,"COVID-19 in India","Mumbai, India","India 's largest compact newspaper .",394712,234,470,"True",2020-11-06,"Note sent municipal commissioners , divisional commissioners district collectors mention testing , ra… ","[]",0,0,0,0,"Note sent municipal commissioners  divisional commissioners district collectors mention testing  ra ","['note']",0,0,0,0,0,0,0,0,0,0,0,0,0,0,0,0,0,0,2020,11,6,"Fri"
20202,0.135936713408013,"Trial Results","","",1438,4995,156418,"False",2020-10-13,"Johnson & ; Johnson ending clinical trials # SARS_CoV_2 phase 3 single “ unexplained i… ","['SARS_CoV_2']",-0.06071429,0.1071429,0,0,"Johnson   Johnson ending clinical trials  SARSCoV2 phase 3 single  unexplained i ","['johnson', 'johnson', 'sarscov2']",0,0,0,0,0,2,0,0,0,0,0,0,0,0,0,0,0,0,2020,10,13,"Tue"
20288,0.193114074343217,"Vaccination Experiences","","Tweets self motivation 💙 Adding profession 🐾",3,15,190,"False",2020-10-21,"Elf luck Trending wish # Money fulfill desires ca n't buy happiness . ","['CovidVaccine']",0.7,0.2,0,0,"Elf luck Trending wish  Money fulfill desires ca nt buy happiness  ","['elf']",0,0,0,0,0,0,0,0,0,0,0,0,0,0,0,0,0,0,2020,10,21,"Wed"
20623,0.143354396470519,"Vaccination Experiences","Lucknow","News , Views & Reviews Digitally",40,60,35,"False",2020-10-13,"Newsreel hour . # johnsonandjohnson # # # CoronaVirusUpdates # pepsico # UttarPradesh… ","['johnsonandjohnson', 'CovidVaccine', 'coronavirus', 'CoronaVirusUpdates', 'pepsico', 'UttarPradesh']",0,0,0,0,"Newsreel hour   johnsonandjohnson    CoronaVirusUpdates  pepsico  UttarPradesh ","['newsreel', 'coronavirusupdates', 'uttarpradesh']",0,0,0,0,0,0,0,0,0,0,0,0,0,0,0,0,0,0,2020,10,13,"Tue"
21120,0.1069520753813,"US government","United States","Lover liberty , boxing enthusiast , father , writer , American Expat . Proud member Secret Society & Co-Inventor `` '' Wheel '' ''",822,803,4902,"False",2020-10-22,"chilling . Firing FDA chief standards would undermine public 's faith any… ","[]",-0.25,0.4833333,0.1333333,0.5666667,"chilling  Firing FDA chief standards would undermine public s faith any ","['fda']",1,0,0,0,0,0,0,0,0,0,0,0,0,0,0,0,0,0,2020,10,22,"Thu"
21252,0.113230507435785,"Trial Results","Right here.","dark stormy night ...",32,351,1599,"False",2020-10-11,"🚫🦈🚫 Nonanimal squalene 's identical chemical nature shark squalene mean equal effectiveness . However , shar… ","[]",-0.15625,0.46875,-0.15,0.4," Nonanimal squalene s identical chemical nature shark squalene mean equal effectiveness  However  shar ","['nonanimal']",0,0,0,0,0,0,0,0,0,0,0,0,0,0,0,0,0,0,2020,10,11,"Sun"
21378,0.146238089314624,"Case/Vaccination Statistics","London","n't distrust MSM , keep close eye everyone .",494,211,7899,"False",2020-10-16,"According # euronews report , 63 % Britons would take # next year . 37 % French a… ","['euronews', 'Covidvaccine']",0,0,0,0,"According  euronews report  63  Britons would take  next year  37  French a ","['britons']",0,0,0,0,0,0,0,0,0,0,0,0,0,0,0,0,0,0,2020,10,16,"Fri"
21449,0.169034491329341,"Trial Results","RNA World","RNA ( ) Therapeutics Investor-Scientist loves trade tweet biotech stocks investment advice . Likes bookmarks . .",9490,346,7595,"False",2020-10-15,"# UK czar Kate Bingham takes Novavax shot ... good . good : 93 % participati… ","['covidvaccine']",0.7,0.6,0,0," UK czar Kate Bingham takes Novavax shot  good  good  93  participati ","['kate bingham', 'novavax']",0,0,0,0,0,0,0,0,0,0,0,0,0,0,0,0,0,0,2020,10,15,"Thu"
21549,0.144310328987899,"Trial Results","Mumbai, India","Let 's Change Attitudes towards Disability bridging information gap . Newz Hook shares voice people . Disability , Inclusion & Accessibility News .",3304,1863,418,"True",2020-10-14,"USA-based Johnson & ; Johnson ( J & ; J ) amongst one companies working vaccine.… ","[]",0,0,0,0,"USAbased Johnson   Johnson  J   J  amongst one companies working vaccine ","['johnson johnson']",0,0,0,0,0,0,0,0,0,0,0,0,0,0,0,0,0,0,2020,10,14,"Wed"
21569,0.103287250784459,"US government","Pittsburgh, PA","Communication & PR specialist , forced & reluctant online instructor . want president forget 5 days week . # VoteBlue2020 # FBR",2712,2696,39133,"False",2020-11-03,"’ # promised Election Day , @ realDonaldTrump ? mean election 2024 we… ","['COVIDvaccine']",-0.3125,0.6875,-0.3,0.2,"  promised Election Day   realDonaldTrump  mean election 2024 we ","[]",0,0,0,0,0,0,0,0,0,0,0,0,0,0,0,0,0,0,2020,11,3,"Tue"
21651,0.145450483852559,"Trial Results","United States","# Vote . Travel . Write . Things . Say Things . Drink Wine . Fight like girl ...",190,177,45517,"False",2020-10-20,"@ nytimes recipients magic # # Uyghur held concentration camps ? Asking # unhrc","['CovidVaccine', 'Uyghur', 'unhrc']",0.5,1,0,0," nytimes recipients magic   Uyghur held concentration camps  Asking  unhrc","['uyghur']",0,0,0,0,0,0,0,0,0,0,0,0,0,0,0,0,0,0,2020,10,20,"Tue"
21944,0.144310328987899,"Trial Results","Ottawa","Award-winning reporter | Eye Canada 's politics @ business | PhD candidate | Ex @ POLITICOEurope @ dwnews | @ IWMF fellow | views | kbolongaro @ bloomberg.net",2688,512,10112,"True",2020-10-14,"Cargo Cavalry Sizes Readiness Historic Airlift  @ b_muzz # #","['Covid19', 'CovidVaccine']",0,0,0,0,"Cargo Cavalry Sizes Readiness Historic Airlift   bmuzz  ","['cargo', 'cavalry sizes readiness historic airlift']",0,0,0,0,0,0,0,0,0,0,0,0,0,0,0,0,0,0,2020,10,14,"Wed"
22033,0.0668622799122565,"US government","Reston, VA","Snowfish provides life science decision makers innovative insights . 're experts aspects stakeholder mapping engagement .",31,58,4,"False",2020-10-13,"Rushing - scary history .  # # rushedvaccine","['covidvaccine', 'rushedvaccine']",-0.5,1,0.5,1,"Rushing  scary history     rushedvaccine","[]",0,0,0,0,0,0,0,0,0,0,0,0,0,0,0,0,0,0,2020,10,13,"Tue"
22094,0.163146063605052,"Trial Results","Noida, India","One stop platform tracks breaking news & analysis pulsating healthcare industry .",5940,891,249,"True",2020-10-15,"ETHealthworld | Russia green lights 2nd Ph-3 trials # # # Phase3Trials… ","['Covid19', 'Coronavirus', 'Phase3Trials']",-0.1,0.15,0,0,"ETHealthworld  Russia green lights 2nd Ph3 trials    Phase3Trials ","['ethealthworld', 'russia']",0,1,0,0,0,0,0,0,0,0,0,0,0,0,0,0,0,0,2020,10,15,"Thu"
22243,0.144686071186026,"Case/Vaccination Statistics","San Francisco, CA | Washington DC","Filling need trusted information national health issues | nonprofit organization | health policy analysis , journalism & polling",109265,16,1711,"True",2020-10-20,"NEW : safe effective # , nation begin massive effort distribute hundred… ","['COVIDVaccine']",0.3090909,0.6886364,0,0,"NEW  safe effective   nation begin massive effort distribute hundred ","['new']",0,0,0,0,0,0,0,0,0,0,0,0,0,0,0,0,0,0,2020,10,20,"Tue"
22260,0.115971146241437,"Trial Results","","",399,183,83,"False",2020-10-19,"companies final stages testing , @ cdc says children may recommended for… ","[]",0,1,0,0,"companies final stages testing   cdc says children may recommended for ","[]",0,0,0,0,0,0,0,0,0,0,0,0,0,0,0,0,0,0,2020,10,19,"Mon"
22290,0.140518208554547,"Government Response","","",1,44,989,"False",2020-10-10,"# coming soon like protection # PreExistingConditions funding our… ","['CovidVaccine', 'PreExistingConditions']",0,0,0,0," coming soon like protection  PreExistingConditions funding our ","[]",0,0,0,0,0,0,0,0,0,0,0,0,0,0,0,0,0,0,2020,10,10,"Sat"
22334,0.151150896314046,"Case/Vaccination Statistics","United States","Twitter account Vaccinate Family ( former twitter handle @ ShotofPrev ) . discuss # people ages .",8541,2203,2065,"False",2020-10-21,"States prepare safety reviews amid worries Trump ’ influence FDA… ","[]",0,0,0,0,"States prepare safety reviews amid worries Trump  influence FDA ","['trump', 'fda']",1,0,0,0,0,1,0,0,0,0,0,0,0,0,0,0,0,0,2020,10,21,"Wed"
22354,0.141119620256347,"COVID-19 in India","India","India 's NEWS Channel Digital Media ! get touch us , send Direct Message",1088,186,280,"False",2020-10-17,"Headlines indian national daily - 17 Oct # NarendraModi # # JammuAndKashmir # Punjab # Assam ","['NarendraModi', 'CovidVaccine', 'JammuAndKashmir', 'Punjab', 'Assam']",0,0,0.05,0.2,"Headlines indian national daily  17 Oct  NarendraModi   JammuAndKashmir  Punjab  Assam ","['jammuandkashmir punjab assam']",0,0,0,0,0,0,0,0,0,0,0,0,0,0,0,0,0,0,2020,10,17,"Sat"
22554,0.113258255168945,"Trial Results","Sultanpur, New Delhi","editorji curated short video news platform . latest news updates , download editorji app : ",31537,105,217,"True",2020-10-13,"Johnson & ; Johnson temporarily halted trials due `` '' unexplained illness '' '' participa… ","[]",-0.0875,0.1875,0.25,0.6,"Johnson   Johnson temporarily halted trials due   unexplained illness   participa ","['johnson', 'johnson']",0,0,0,0,0,2,0,0,0,0,0,0,0,0,0,0,0,0,2020,10,13,"Tue"
22729,0.138729241882366,"Education","Toronto, Ontario","provide ultimate healthcare solutions , supports mental physical well-being Canadians . 're # HR solution .",996,1042,1496,"False",2020-10-19,"want news treatments . week Mike Sullivan , CEO @ cubichealth , sharing latest o… ","[]",0.5,0.9,-0.03333333,0.447619,"want news treatments  week Mike Sullivan  CEO  cubichealth  sharing latest o ","['mike sullivan']",0,0,0,0,0,0,0,0,0,0,0,0,0,0,0,0,0,0,2020,10,19,"Mon"
22846,0.152149584455102,"COVID-19 in India","","",211,199,8586,"False",2020-10-22,"@ Shobbha2 @ jhanpoo2 @ ANI Translation : @ SonuSood provide . # SonuSoodRealHero # NirmalaSitharaman… ","['SonuSoodRealHero', 'NirmalaSitharaman']",0,0,0,0," Shobbha2  jhanpoo2  ANI Translation   SonuSood provide   SonuSoodRealHero  NirmalaSitharaman ","['shobbha2', 'ani translation', 'sonusoodrealhero']",0,0,0,0,0,0,0,0,0,0,0,0,0,0,0,0,0,0,2020,10,22,"Thu"
22919,0.108491532535549,"Mask","","Politics good idea , ruined Politicians",348,301,11603,"False",2020-11-04,"Settlement teenager swine flu - reason neither family taking… ","[]",0,0,0.7,0.6,"Settlement teenager swine flu  reason neither family taking ","['settlement']",0,0,0,0,0,0,0,0,0,0,0,0,0,0,0,0,0,0,2020,11,4,"Wed"
22954,0.138105630889472,"Government Response","England, United Kingdom","world 's foremost independent global freight management & logistics network",291,175,277,"False",2020-10-16,"Communication , transparency , cooperation needed ensure every player chain agile enough to… ","[]",0.25,0.625,0,0.0625,"Communication  transparency  cooperation needed ensure every player chain agile enough to ","[]",0,0,0,0,0,0,0,0,0,0,0,0,0,0,0,0,0,0,2020,10,16,"Fri"
23090,0.140657424499739,"Case/Vaccination Statistics","Makati City","Without fear . Without favor .",5344,228,201,"False",2020-10-14,"103 million Filipinos get free shot . # ","['covidvaccine']",0.4,0.8,0,0,"103 million Filipinos get free shot   ","[]",0,0,0,0,0,0,0,0,0,0,0,0,0,0,0,0,0,0,2020,10,14,"Wed"
23651,0.148361511326296,"COVID-19 in India","India","leading digital video media firm startups entrepreneurs . Follow @ channeliam @ channeliamhindi @ imstartupstudio",563,393,1154,"False",2020-10-20,"Serum Institute , Bharat Biotech soon begin trial intranasal # SerumInstitute… ","['SerumInstitute']",0,0,-0.1,0.2,"Serum Institute  Bharat Biotech soon begin trial intranasal  SerumInstitute ","['serum', 'institute bharat biotech', 'seruminstitute']",0,0,0,0,0,0,0,0,0,0,0,0,0,0,0,0,0,0,2020,10,20,"Tue"
23655,0.116769368806382,"Trial Results","London","n't distrust MSM , keep close eye everyone .",500,212,8132,"False",2020-10-20,"n't expert realise so-called Challenge Trials utter pseudo-science . participant… ","[]",0,1,0,0,"nt expert realise socalled Challenge Trials utter pseudoscience  participant ","['challenge trials']",0,0,0,0,0,0,0,0,0,0,0,0,0,0,0,0,0,0,2020,10,20,"Tue"
23755,0.179802940600401,"Trial Results","India","Breaking news alerts India . Instagram :  YouTube : ",13866348,15,0,"True",2020-10-18,"China Extends Emergency Use Three Cities  # ","['COVIDVaccine']",0,0,0,0,"China Extends Emergency Use Three Cities   ","['china', 'extends emergency']",0,1,0,0,0,0,0,0,0,0,0,0,0,0,0,0,0,0,2020,10,18,"Sun"
24132,0.135825846062043,"Gratitude and Optimism","London","n't distrust MSM , keep close eye everyone .",494,211,7899,"False",2020-10-13,"`` `` God willing '' '' . Susanna Reid makes clear , future , sell upcoming jab Brit… ","[]",0.1166667,0.4194444,0,0,"  God willing    Susanna Reid makes clear  future  sell upcoming jab Brit ","['susanna reid', 'brit']",0,0,0,0,0,0,0,0,0,0,0,0,0,0,0,0,0,0,2020,10,13,"Tue"
24224,0.0642028136416751,"Mask","Canada","question everything . Fighter underdog . Exposing minority report . title automatically = knowledgeable , wise , ethical .",1037,919,61707,"False",2020-11-07,"Al Gore . n't say something oceans physically IMPOSSIBLE ? # ClimateChange aka # GlobalWarming… ","['ClimateChange', 'GlobalWarming']",-0.6666667,1,0.45,0.75,"Al Gore  nt say something oceans physically IMPOSSIBLE   ClimateChange aka  GlobalWarming ","['al', 'gore', 'impossible']",0,0,0,0,0,0,0,0,0,0,0,0,0,0,0,0,0,0,2020,11,7,"Sat"
24287,0.162534014579639,"Case/Vaccination Statistics","New Delhi, India","Healthwire leading digital platform bringing # news Health & Wellness . aim healthier tomorrow .",5010,394,139,"False",2020-10-21,": Low-Cost Paper-Based Test Available India Soon Results Within Hour @ MoHFW_INDIA # covid19… ","['covid19']",0.4,0.4,0,0," LowCost PaperBased Test Available India Soon Results Within Hour  MoHFWINDIA  covid19 ","['lowcost', 'test available india soon results within hour']",0,0,0,0,0,0,0,0,0,0,0,0,0,0,0,0,0,0,2020,10,21,"Wed"
24333,0.110515408518668,"COVID-19 in India","New Delhi, India","Healthwire leading digital platform bringing # news Health & Wellness . aim healthier tomorrow .",5018,393,136,"False",2020-10-12,"Unmarried Men Likely Die : Study @ MoHFW_INDIA @ ICMRDELHI # # Unmarried… ","['COVID19', 'Unmarried']",0,1,0,0,"Unmarried Men Likely Die  Study  MoHFWINDIA  ICMRDELHI   Unmarried ","['men likely die study', 'mohfwindia']",0,0,0,0,0,0,0,0,0,0,0,0,0,0,0,0,0,0,2020,10,12,"Mon"
24425,0.131293017190969,"COVID-19 in India","India","Political & Social Analyst . # IndiaFirst Privilege - PM @ narendramodi ji follows . views Strictly Personal . RTs endorsements # VandeMataram",8304,177,30751,"False",2020-11-05,"India-made could launched early February 2021 . Govt Scientists . # CovidVaccine… ","['CovidVaccine']",0.1,0.3,0.01111111,0.1555556,"Indiamade could launched early February 2021  Govt Scientists   CovidVaccine ","['indiamade', 'covidvaccine']",0,0,0,0,1,0,0,0,0,0,0,0,0,0,0,0,0,0,2020,11,5,"Thu"
24862,0.152149584455102,"COVID-19 in India","Kochi, Kerala, India","Journalist , Manorama News",35,277,3,"False",2020-10-22,"Update # # # covishield # covax @ drharshvardhan @ MoHFW_INDIA @ manoramanews ","['Covid19', 'CovidVaccine', 'covishield', 'covax']",0,0,0,0,"Update    covishield  covax  drharshvardhan  MoHFWINDIA  manoramanews ","['update', 'mohfwindia']",0,0,0,0,0,0,0,0,0,0,0,0,0,0,0,0,0,0,2020,10,22,"Thu"
24925,0.0886386595214554,"Trial Results","India","Breaking news alerts India . Instagram :  YouTube : ",13845765,15,0,"True",2020-10-13,"Johnson & ; Johnson Pauses # Trial Participant Falls Ill Read :  ","['CovidVaccine']",-0.5,1,0,0,"Johnson   Johnson Pauses  Trial Participant Falls Ill Read   ","['johnson', 'johnson pauses trial participant falls ill read']",0,0,0,0,0,1,0,0,0,0,0,0,0,0,0,0,0,0,2020,10,13,"Tue"
24973,0.135259778536436,"Trial Results","New Delhi, India","Healthwire leading digital platform bringing # news Health & Wellness . aim healthier tomorrow .",5018,393,136,"False",2020-10-09,"Watch Early Sign Appears Skin Reports @ snehaku97162180 # covid19… ","['covid19']",0.1,0.3,0,0,"Watch Early Sign Appears Skin Reports  snehaku97162180  covid19 ","['watch', 'early sign appears skin reports']",0,0,0,0,0,0,0,0,0,0,0,0,0,0,0,0,0,0,2020,10,9,"Fri"
24981,0.108250287365482,"Vaccination Experiences","California, USA","Empath , Proud Democrat , Integrity , Truth Justice ! California girl Detroit❄🌴 Lions , Tigers , Lakers💜 , Dodgers # BidenHarris2020 💙 # FBR # Resist",5914,6114,98783,"False",2020-10-16,"@ VeronicaNwosu @ GOPChairwoman n't see announcements Walgreens CVS websites today . 'd love see th… ","[]",0.5,0.6,1,1," VeronicaNwosu  GOPChairwoman nt see announcements Walgreens CVS websites today  d love see th ","['veronicanwosu', 'gopchairwoman', 'walgreens cvs']",0,0,0,0,0,0,0,0,0,0,0,0,0,0,0,0,0,0,2020,10,16,"Fri"
25216,0.147209946743976,"US government","Manchester, England","Follow 🔙 Opinionated & Bipolar # KBF",144,216,1704,"False",2020-10-17,"media using queen try push # . Shes HOLISTIC always . Somebody let… ","['COVID19']",0,0,0,0,"media using queen try push   Shes HOLISTIC always  Somebody let ","['shes']",0,0,0,0,0,0,0,0,0,0,0,0,0,0,0,0,0,0,2020,10,17,"Sat"
25228,0.12840521720566,"Vaccine Mandate","","Guide Dubai including main attractions , travel tips , business directory lot useful expat information .  ",2406,49,11,"False",2020-11-04,"Sheikh Mohammed bin Rashid Al Maktoum receives \ # sheikhmohammed # Dubai… ","['sheikhmohammed', 'Dubai']",0,0,0.2333333,0.1666667,"Sheikh Mohammed bin Rashid Al Maktoum receives   sheikhmohammed  Dubai ","['sheikh', 'mohammed', 'rashid al maktoum', 'dubai']",0,0,0,0,0,0,0,0,0,0,0,0,0,0,0,0,0,0,2020,11,4,"Wed"
25530,0.139287183488904,"Trial Results","","Prof Clinical Immunology & Rheumatology ; Foodie Birder Photography Axiology Metaphysics # Lithium # Battery $ TSLA # RenewableEnergy # EvoBio # COVID2019 # Wine",2928,1423,35466,"False",2020-11-05,"Novavox making subunit . strategy risky putting proverbial eggs antibody bask… ","[]",0,0,0,0,"Novavox making subunit  strategy risky putting proverbial eggs antibody bask ","[]",0,0,0,0,0,0,0,0,0,0,0,0,0,0,0,0,0,0,2020,11,5,"Thu"
25634,0.123506564079897,"Gratitude and Optimism","New Delhi, India","Jagran English new age Trending News site . Check  latest & top trends across globe .",7384,36,88,"True",2020-11-07,"Government process finalising procedure deliver identifying… ","[]",0,0,0.2840909,0.4636364,"Government process finalising procedure deliver identifying ","[]",0,0,0,0,0,0,0,0,0,0,0,0,0,0,0,0,0,0,2020,11,7,"Sat"
25910,0.178222900570158,"Government Response","Noida, India","One stop platform tracks breaking news & analysis pulsating healthcare industry .",6010,890,249,"True",2020-11-06,"ETHealthworld | India tops global survey intent ; rising hesitancy many countries… ","[]",0.25,0.25,0,0,"ETHealthworld  India tops global survey intent  rising hesitancy many countries ","['ethealthworld', 'india']",0,1,0,0,0,0,0,0,0,0,0,0,0,0,0,0,0,0,2020,11,6,"Fri"
26953,0.175269196218667,"COVID-19 in India","Global","Photojournalist . Published author . @ telesurenglish @ CRG_CRM @ buzzfeed @ medium # instagram  # AHCJ @ spj_tweets @ CubaReport ",793,920,7895,"False",2020-10-14,"Russia Registers Second # # : # EpiVacCorona -  via @ shareaholic","['COVID', 'CovidVaccine', 'EpiVacCorona']",0,0,0,0,"Russia Registers Second     EpiVacCorona   via  shareaholic","['russia']",0,1,0,0,0,0,0,0,0,0,0,0,0,0,0,0,0,0,2020,10,14,"Wed"
27011,0.145271554973141,"Case/Vaccination Statistics","Chennai","Business Standard",846,383,476,"False",2020-10-15,"Apollo Hospitals gears administer 1 million daily  @ bsindia… ","[]",0,0,0,0,"Apollo Hospitals gears administer 1 million daily   bsindia ","['apollo', 'hospitals']",0,0,0,0,0,0,0,0,0,0,0,0,0,0,0,0,0,0,2020,10,15,"Thu"
27089,0.127666604398271,"Trial Results","Mumbai, India","Proud Indian | Working Financial Services Sector | # IAmNewIndia | Views Opinions Personal Company|",4378,944,9036,"False",2020-10-19,"challenge ’ adult system… Must build scratch : @ NandanNilekani… ","[]",0.1,0.3,0.2666667,0.4333333,"challenge  adult system Must build scratch   NandanNilekani ","['nandannilekani']",0,0,0,0,0,0,0,0,0,0,0,0,0,0,0,0,0,0,2020,10,19,"Mon"
27576,0.12370573645403,"Vaccination Experiences","Mumbai, India","Ph.D. , IIT Bombay . Biomedical Eng . Research , Art , Music . Work hard , gain knowledge , help spread love .",205,422,2153,"False",2020-10-10,"HOPE ( whole world ) INKTOBER2020 DAY 10 # inktober2020 # inktober2020day10 # hope # CovidVaccine… ","['inktober2020', 'inktober2020day10', 'hope', 'CovidVaccine']",0.2,0.4,0.1041667,0.5708333,"HOPE  whole world  INKTOBER2020 DAY 10  inktober2020  inktober2020day10  hope  CovidVaccine ","['hope', 'inktober2020', 'covidvaccine']",0,0,0,0,1,0,0,0,0,0,0,0,0,0,0,0,0,0,2020,10,10,"Sat"
27852,0.102497267831229,"Case/Vaccination Statistics","","Official All-Party Parliamentary Group Vulnerable Groups Pandemics cross-party group UK Parliamentarians concerned # vulnerablegroups",186,76,32,"False",2020-10-12,"Thank @ SteveBakerHW asking vulnerable population today 's briefing… ","[]",-0.5,0.5,-0.5,0.5,"Thank  SteveBakerHW asking vulnerable population today s briefing ","['thank']",0,0,0,0,0,0,0,0,0,0,0,0,0,0,0,0,0,0,2020,10,12,"Mon"
28284,0.0936455328301352,"Trial Results","Santiago + Toronto","Biological Anthropology , Psychology , Digital Archaeology . Exploring human condition interaction machines .",284,604,2463,"False",2020-10-22,"Volunteer Oxford # study , part control group , died . 's unfortunate , 'm sorry… ","['CovidVaccine']",-0.5,1,0,0.05,"Volunteer Oxford  study  part control group  died  s unfortunate  m sorry ","['volunteer']",0,0,0,0,0,0,0,0,0,0,0,0,0,0,0,0,0,0,2020,10,22,"Thu"
28374,0.267776462292392,"Trial Results","Honolulu","",238,1231,3472,"False",2020-11-06,"rundown promising prospects work , layman 's terms # COVIDー19… ","['COVIDー19']",0.2,0.5,0,0,"rundown promising prospects work  layman s terms  COVID19 ","['covid19']",0,0,0,1,0,0,0,0,0,0,0,0,0,0,0,0,0,0,2020,11,6,"Fri"
28379,0.107263233699118,"Trial Results","India","Breaking news alerts India . Instagram :  YouTube : ",13943890,15,0,"True",2020-11-04,"Oxford # Trial Results Likely Year : Chief Investigator  ","['CovidVaccine']",0,1,0,0,"Oxford  Trial Results Likely Year  Chief Investigator  ","['oxford', 'trial results']",0,0,0,0,0,0,0,0,0,0,0,0,0,0,0,0,0,0,2020,11,4,"Wed"
28612,0.177524719400958,"COVID-19 in India","India","Youtube :  Facebook :  Instagram : ",593210,114,0,"True",2020-10-16,"ET Reports : India ’ drug regulatory authority sought information Serum Institute India its… ","[]",0,0,0,0,"ET Reports  India  drug regulatory authority sought information Serum Institute India its ","['india', 'serum institute india']",0,1,0,0,0,0,0,0,0,0,0,0,0,0,0,0,0,0,2020,10,16,"Fri"
28651,0.127063887829724,"Trial Results","bangor, north wales, uk","secular humanist & defender freedom & free speach-father 2 , grandfather 4-likes music , rugby , boxing , tennis.fav rtist mary j blige .",1306,961,528,"False",2020-11-08,"Russia already developing Mers , similar virus struck & ; already develop… ","[]",0,0.4,0.4,0.8,"Russia already developing Mers  similar virus struck   already develop ","['russia', 'mers']",0,1,0,0,0,0,0,0,0,0,0,0,0,0,0,0,0,0,2020,11,8,"Sun"
28942,0.14744719595846,"COVID-19 in India","India","India ’ watched Hindi News Channel . Follow latest/breaking News Alerts Globe . FB : ",1455120,42,347,"True",2020-10-22,"Free , ready : Tamil Nadu CM Edappadi K Palaniswami # # COVID19… ","['coronavirus', 'COVID19']",0.3,0.65,0,0,"Free  ready  Tamil Nadu CM Edappadi K Palaniswami   COVID19 ","['free', 'tamil nadu cm edappadi']",0,0,0,0,0,0,0,0,0,0,0,0,0,0,0,0,0,0,2020,10,22,"Thu"
29034,0.133438979033419,"Gratitude and Optimism","Geneva, Switzerland","humanitarian physician believes people . ( tweets absolutely opinion )",32,151,308,"False",2020-10-14,"Great going Awad ! ’ fulfilling dream come true much needed one today ’ world ! ! … ","[]",0.5541667,0.5333333,0.2,0.9,"Great going Awad   fulfilling dream come true much needed one today  world    ","['great', 'awad']",0,0,0,0,0,0,0,0,0,0,0,0,0,0,0,0,0,0,2020,10,14,"Wed"
29094,0.122038647571413,"Government Response","Singapore","Entrepreneur . Investor mio Research & Development logical base algo innovations . Day trading & Swing Trade futures . Fan Floor Jansen",130,58,1437,"False",2020-10-13,"# johnsonnjohnson # half # HongKong halts stock index storm # SouthKorea triple digit… ","['johnsonnjohnson', 'CovidVaccine', 'HongKong', 'SouthKorea']",-0.1666667,0.1666667,-0.275,0.625," johnsonnjohnson  half  HongKong halts stock index storm  SouthKorea triple digit ","['hongkong', 'southkorea']",0,0,0,0,0,0,0,0,0,0,0,0,0,0,0,0,0,0,2020,10,13,"Tue"
