"X","misinformation","dominant_topic","user_location","user_description","user_followers","user_friends","user_favourites","user_verified","date","text","hashtags","polarity_text","subjectivity_text","polarity_description","subjectivity_description","cleaned_text","entities","Organizations","Locations","Symptoms","COVID","Vaccination","Politics","Conspiracy","Slurs","Masks","Miscellaneous","origin","vaccine_conspiracy","government","pharma","Five_G","gates","nwo","media","year","month","day","day_of_week"
76337,0.13535132246749,"Vaccination Experiences","","EM Doc working cure , Zika , Ebola , etc ! Faculty @ gwsmhs @ usuhs , mom x 5 , Director Clinical Trials @ WRAIR , opinions !",573,647,2482,"False",2020-10-16,"Exciting news - barring last minute safety issues , likely first one “ gate ” … ","[]",0.1375,0.55,0,0,"Exciting news  barring last minute safety issues  likely first one  gate   ","[]",0,0,0,0,0,0,0,0,0,0,0,0,0,0,0,0,0,0,2020,10,16,"Fri"
76715,0.141158911829242,"Mask","United States","horse man",8,48,881,"False",2020-11-07,"know ? n't think # going anything us anyway . Think people don… ","['CovidVaccine']",0,0,0,0,"know  nt think  going anything us anyway  Think people don ","[]",0,0,0,0,0,0,0,0,0,0,0,0,0,0,0,0,0,0,2020,11,7,"Sat"
76990,0.13187921963427,"Government Response","RNA World","RNA ( ) Therapeutics Investor-Scientist loves trade tweet biotech stocks investment advice . Likes bookmarks . .",9490,346,7595,"False",2020-10-10,"# couldnt care less Trump declared victory positive $ bntx $ pfe topline data be4 election+EUA nov3 . $ nvax $ mrna","['covidvaccine']",0.03030303,0.3060606,0,0," couldnt care less Trump declared victory positive  bntx  pfe topline data be4 electionEUA nov3   nvax  mrna","['trump', 'electioneua']",0,0,0,0,0,1,0,0,0,0,0,0,0,0,0,0,0,0,2020,10,10,"Sat"
77055,0.137085413625238,"Mask","Tamil Nadu, India","திராவிடன் .",431,964,4565,"False",2020-10-22,"One thing 's clear - accountability completely window far @ BJP4India Government concerned.… ","[]",0.1,0.5944444,0,0,"One thing s clear  accountability completely window far  BJP4India Government concerned ","['bjp4india']",0,0,0,0,0,0,0,0,0,0,0,0,0,0,0,0,0,0,2020,10,22,"Thu"
77085,0.111196777317995,"Education","","Hey ’ funny mom trying get famous tik toks !",4,48,1,"False",2020-10-13,"happen 19 comes # # COVID19Vic # # zombie # TikTok… ","['COVID19', 'COVID19Vic', 'CovidVaccine', 'zombie', 'TikTok']",0,0,0.4375,1,"happen 19 comes   COVID19Vic   zombie  TikTok ","['covid19vic']",0,0,0,0,1,0,0,0,0,0,0,0,0,0,0,0,0,0,2020,10,13,"Tue"
77125,0.140054451382231,"Trial Results","India","India ’ watched Hindi News Channel . Follow latest/breaking News Alerts Globe . FB : ",1453391,42,345,"True",2020-10-13,"Johnson Johnson halts trial following unexplained illness participant | via @ IndiaTVNews… ","[]",-0.025,0.05,0,0,"Johnson Johnson halts trial following unexplained illness participant  via  IndiaTVNews ","['johnson', 'johnson', 'indiatvnews']",0,0,0,0,0,2,0,0,0,0,0,0,0,0,0,0,0,0,2020,10,13,"Tue"
77162,0.150157602459718,"Vaccine Mandate","St. Louis, Missouri","Elevating health healthcare designing # healthcaresupplychain solutions improve members ’ financial , operational clinical performance . # GPO",1976,415,1226,"False",2020-10-20,"Healthcare executives fear organizations viability without #  by… ","['COVID19']",0,0,0,0,"Healthcare executives fear organizations viability without   by ","['healthcare']",0,0,0,0,0,0,0,0,0,0,0,0,0,0,0,0,0,0,2020,10,20,"Tue"
77208,0.113796988392689,"Trial Results","Where attempts to escape cease","Corto Maltese 's Lover , # Futuristic Mind . # Biotech Executive , # HealthPolicy advocate , # healthTECH enthusiast , # startup lover , thrilled # AI # healthcare",93,557,480,"False",2020-10-14,"# paused . # safetyfirst ","['COVIDVACCINE', 'safetyfirst']",0,0,0.6,0.7," paused   safetyfirst ","[]",0,0,0,0,0,0,0,0,0,0,0,0,0,0,0,0,0,0,2020,10,14,"Wed"
77550,0.106064966470571,"Trial Results","Jaipur, India","Welcome Official Twitter page First India Newspaper . Follow us latest updates . # FirstIndia",6127,205,98,"False",2020-10-10,"Bharat Biotech asked submit complete data ongoing phase-2 trial # candidate proceedi… ","['COVID19']",0.1,0.4,0.5166667,0.7111111,"Bharat Biotech asked submit complete data ongoing phase2 trial  candidate proceedi ","['bharat', 'biotech']",0,0,0,0,0,0,0,0,0,0,0,0,0,0,0,0,0,0,2020,10,10,"Sat"
78202,0.13296441048854,"Trial Results","","Christina VandePol , M.D. , Coroner Chester County ( PA ) . Tweets views Chester County positions .",233,51,8,"False",2020-10-12,"heard : Moderna # trial closed enrollment EXCEPT people color underrepre… ","['CovidVaccine']",-0.1,0.1,0,0,"heard  Moderna  trial closed enrollment EXCEPT people color underrepre ","['moderna']",1,0,0,0,0,0,0,0,0,0,0,0,0,0,0,0,0,0,2020,10,12,"Mon"
78248,0.123576896354508,"Mask","New York, USA","Mother , Environmentalist , Awoken Lightworker , pro-safety , pro-science , pro-informed consent , ex-vaxxer pro-religion !",364,224,3886,"False",2020-11-03,"prevent transmission lesser symptoms . thanks ! Especially symptoms nothing for… ","[]",0.08333333,0.5666667,0,0,"prevent transmission lesser symptoms  thanks  Especially symptoms nothing for ","[]",0,0,0,0,0,0,0,0,0,0,0,0,0,0,0,0,0,0,2020,11,3,"Tue"
78704,0.157910785318069,"COVID-19 in India","Noida, India","Stay connected economic commercial trends world .",816,316,264,"True",2020-10-10,"Speed Read : Indo-Israel research provide result less minute ; Russia launch second va… ","[]",-0.08333333,0.03333333,0.1,0.1,"Speed Read  IndoIsrael research provide result less minute  Russia launch second va ","['speed', 'read indoisrael', 'russia']",0,1,0,0,0,0,0,0,0,0,0,0,0,0,0,0,0,0,2020,10,10,"Sat"
78723,0.104182846368942,"Government Response","London","Science Correspondent Sky News . BAFTA winner . Award winning documentary maker . Leading Sky ’ environment coverage & @ SkyOceanRescue campaign Thomas.moore @ sky.uk",6223,331,556,"True",2020-11-04,"# : UK taskforce chief says 50 % confident vulnerable people access a… ","['CovidVaccine']",0,0.6666667,0.25,0.375,"  UK taskforce chief says 50  confident vulnerable people access a ","[]",0,0,0,0,0,0,0,0,0,0,0,0,0,0,0,0,0,0,2020,11,4,"Wed"
78782,0.115429913070384,"COVID-19 in India","India","Getting rid everything essential making point . . cup tea day , keeps ghosts away .",342,1912,14956,"False",2020-11-06,"# Expected Soon . # COVID19India Go Corona⚡ ","['CovidVaccine', 'COVID19India']",-0.1,0.4,0,0.3," Expected Soon   COVID19India Go Corona ","['soon covid19india go corona']",0,0,0,0,0,0,0,0,0,0,0,0,0,0,0,0,0,0,2020,11,6,"Fri"
79461,0.139287183488904,"Trial Results","Noida, India","One stop platform tracks breaking news & analysis pulsating healthcare industry .",6010,890,249,"True",2020-11-05,"ETHealthworld | Scientists develop `` '' ultrapotent '' '' candidate # # # CovidCases… ","['CovidVaccine', 'Covid', 'CovidCases']",0,0,0,0,"ETHealthworld  Scientists develop   ultrapotent   candidate    CovidCases ","['ethealthworld', 'covidcases']",0,0,0,0,0,0,0,0,0,0,0,0,0,0,0,0,0,0,2020,11,5,"Thu"
79666,0.134971397233382,"Trial Results","","Came idea NippyNews ... ... ... ..try ",1129,105,0,"False",2020-11-05,"Tribune - India-made could launched early February : ICMR scientist # ICMR # icmrscientist… ","['ICMR', 'icmrscientist']",0.1,0.3,0,0,"Tribune  Indiamade could launched early February  ICMR scientist  ICMR  icmrscientist ","['tribune indiamade', 'icmr']",0,0,0,0,0,0,0,0,0,0,0,0,0,0,0,0,0,0,2020,11,5,"Thu"
79827,0.120137161183291,"Government Response","Jubilee Hills, Hyderabad","Watch ABN Andhrajyothy , 1 Telugu news channel,24/7 LIVE news channel dedicated live reports , exclusive interviews , breaking news , sports , entertainment .",141125,2,3,"False",2020-10-13,"త్వరలో కరోనా వాక్సిన్.. Big Breaking : Coming Soon Expected Early 2021 | Harsha Vardhan |… ","[]",0,0.2666667,0.1363636,0.5,"   Big Breaking  Coming Soon Expected Early 2021  Harsha Vardhan  ","['harsha vardhan']",0,0,0,0,0,0,0,0,0,0,0,0,0,0,0,0,0,0,2020,10,13,"Tue"
79837,0.109513735259046,"COVID-19 in India","","Education | News | World Affairs",7,0,101,"False",2020-11-07,"Bangladesh signed deal Serum Institute India buy 30 million doses potential vac… ","[]",0,1,0,0,"Bangladesh signed deal Serum Institute India buy 30 million doses potential vac ","['bangladesh', 'serum institute india']",0,0,0,0,0,0,0,0,0,0,0,0,0,0,0,0,0,0,2020,11,7,"Sat"
79906,0.147686740498836,"Vaccination Experiences","","Colombia / USA",31,260,1629,"False",2020-10-12,"Officially starting taking part Phase 3 clinical study tomorrow ! Happy contribute t… ","[]",0.4,0.55,0,0,"Officially starting taking part Phase 3 clinical study tomorrow  Happy contribute t ","['happy']",0,0,0,0,0,0,0,0,0,0,0,0,0,0,0,0,0,0,2020,10,12,"Mon"
79934,0.148259878359579,"Vaccine Mandate","Bratislava","British European , Liberal , Remainer & pro-EU . # tanktopbumboy 🇸🇰🇬🇧🇪🇺🏳️‍🌈",671,661,6097,"False",2020-10-20,"1 Chinese city offering experimental # $ 60 . free experimental # available i… ","['CovidVaccine', 'vaccine']",0.2,0.4,0,0,"1 Chinese city offering experimental   60  free experimental  available i ","['chinese']",0,0,0,0,0,0,0,0,0,0,0,0,0,0,0,0,0,0,2020,10,20,"Tue"
80585,0.094894166249792,"Government Response","Boston, MA","Powerful ideas healthier world .",366230,2647,13335,"True",2020-11-03,"`` `` [ ] distribution process apolitical possible , free governed favor m… ","[]",0.2,0.9,0.3,1,"    distribution process apolitical possible  free governed favor m ","[]",0,0,0,0,0,0,0,0,0,0,0,0,0,0,0,0,0,0,2020,11,3,"Tue"
80794,0.138518477862098,"COVID-19 in India","India","Follow  Breaking News around world , live cricket updates , bollywood gossips , travel tips latest trends .",12814,370,313,"True",2020-10-14,"Earlier , India Institute Medical Sciences ( AIIMS ) Director Dr Randeep Guleria said for… ","[]",0,0.25,0.3181818,0.7,"Earlier  India Institute Medical Sciences  AIIMS  Director Dr Randeep Guleria said for ","['india', 'medical sciences', 'aiims', 'randeep guleria']",0,1,0,0,0,0,0,0,0,0,0,0,0,0,0,0,0,0,2020,10,14,"Wed"
80843,0.123664849174997,"US government","peak district uk","MCFC , bit politics , curry great outdoors . ST - East Stand L1 . Irish citizen . Europe stand . sit , whatever .",2120,1826,5178,"False",2020-11-03,"Without anti lobby , world would n't know really worked . Go anti lobby # # Antilockdown","['CovidVaccine', 'Antilockdown']",0.2,0.2,0.4,0.375,"Without anti lobby  world would nt know really worked  Go anti lobby   Antilockdown","[]",0,0,0,0,0,0,0,0,0,0,0,0,0,0,0,0,0,0,2020,11,3,"Tue"
81778,0.144310328987899,"Trial Results","New Delhi, Delhi","Official twitter handle UNI-India 's premier multilingual news agency !",2077,0,181,"False",2020-10-14,"Phase-3 trials deferred fortnight Lucknow hospital # # Covaxin # Phase3Trials… ","['CovidVaccine', 'Covaxin', 'Phase3Trials']",0,0,0,0,"Phase3 trials deferred fortnight Lucknow hospital   Covaxin  Phase3Trials ","['phase3', 'lucknow']",0,0,0,0,0,0,0,0,0,0,0,0,0,0,0,0,0,0,2020,10,14,"Wed"
81804,0.125299369616671,"Clinic Updates and Information","Namakkal, Tamilnadu","Tamil Film Fanatic . Proud Tamilan..Love watch & organize sports events kids..Family backbone growth ... Future undecided..",168,682,37596,"False",2020-10-22,"@ disdumdimidilda U got directly finance minister promises Bihar people others needs wait there… ","[]",0.1,0.4,0.1666667,0.6416667," disdumdimidilda U got directly finance minister promises Bihar people others needs wait there ","[]",0,0,0,0,0,0,0,0,0,0,0,0,0,0,0,0,0,0,2020,10,22,"Thu"
82197,0.148187141833009,"COVID-19 in India","","",37,0,1,"False",2020-10-18,"balanced coverage errands ( n't believe ... 's another story ) .… ","[]",0,0,0,0,"balanced coverage errands  nt believe  s another story   ","[]",0,0,0,0,0,0,0,0,0,0,0,0,0,0,0,0,0,0,2020,10,18,"Sun"
82273,0.123357989775279,"Trial Results","Maryland","Top Cosmetic , Surgical General Dermatologist - Board Certified - Tweets medical advice",1994,324,977,"False",2020-10-17,"Johnson & ; Johnson said study temporarily halted due unexplained illness tr… ","[]",-0.0875,0.1875,0.1833333,0.3333333,"Johnson   Johnson said study temporarily halted due unexplained illness tr ","['johnson', 'johnson']",0,0,0,0,0,2,0,0,0,0,0,0,0,0,0,0,0,0,2020,10,17,"Sat"
82487,0.116743528942437,"Trial Results","Nyon, Switzerland","PhD , Expert Future Work ( ers ) & Politics Tech . Workers Voice . Affiliate FAOS , DK . Global keynote speaker | 💯ethicsinAI influencer Tech4Good |",3189,2293,7851,"False",2020-11-04,"media reporting possible # tested elderly first.The risks high an… ","['CovidVaccine']",0.08,0.77,0,0.0625,"media reporting possible  tested elderly firstThe risks high an ","['firstthe']",0,0,0,0,0,0,0,0,0,0,0,0,0,0,0,0,0,0,2020,11,4,"Wed"
82509,0.142347879214545,"Trial Results","United State of America","PROVIDE KINDS International NEWS various location World . Join us news Update .",132,10,93,"False",2020-10-18,"# Sinovac Biotech # offered # Chinese city emergency use costs $ 60  ","['Sinovac', 'covidvaccine', 'Chinese']",0,0,0,0.25," Sinovac Biotech  offered  Chinese city emergency use costs  60  ","['sinovac', 'biotech', 'chinese']",0,0,0,0,0,0,0,0,0,0,0,0,0,0,0,0,0,0,2020,10,18,"Sun"
82515,0.125767731775048,"Education","Malaysia and Thailand","Asia Centre not-for-profit organisation seeks create human rights impact region . ",535,882,85,"False",2020-10-21,"Benedict Anderson round table & ; Nationalism . Due issue affect distributio… ","[]",-0.1625,0.3875,0,0.1,"Benedict Anderson round table   Nationalism  Due issue affect distributio ","['benedict', 'anderson']",0,0,0,0,0,0,0,0,0,0,0,0,0,0,0,0,0,0,2020,10,21,"Wed"
82549,0.131391132092123,"Trial Results","Bengaluru","Look south , think TNM . News , ground reports analysis south India . membership related queries : members @ thenewsminute.com",163231,991,1388,"True",2020-11-06,"Bharat Biotech ’ Covaxin may see February 2021 launch , says ICMR scientist # # ","['COVID19', 'COVIDvaccine']",0,0,0,0.4,"Bharat Biotech  Covaxin may see February 2021 launch  says ICMR scientist   ","['bharat', 'biotech covaxin', 'icmr']",0,0,0,0,0,0,0,0,0,0,0,0,0,0,0,0,0,0,2020,11,6,"Fri"
82771,0.147261225885977,"US government","Pune, India","MNS pune secretary , participation social work Maitri foundation , part Punyabhushan Tridal team.Views expressed strictly personal .",127,361,3969,"False",2020-10-22,"party government `` '' promise '' '' citizens state manifesto , n't thei… ","[]",0,0,0.01666667,0.1833333,"party government   promise   citizens state manifesto  nt thei ","[]",0,0,0,0,0,0,0,0,0,0,0,0,0,0,0,0,0,0,2020,10,22,"Thu"
82880,0.147186063471806,"Government Response","At gym or reading","GOAT Brand Strategist 🔥 w/ penchant sci , econ , fin , policy , transparency , pumping iron , # CobraKai & saving 🌎 . Took 9 yrs start tweeting ( shy ) .",73,45,126,"False",2020-10-16,"CoviDollars : better way mess ?  # # BehavioralEconomics # # publichealth #","['Covid', 'BehavioralEconomics', 'coronavirus', 'publichealth', 'CovidVaccine']",0.1625,0.3375,-0.5,0.5,"CoviDollars  better way mess     BehavioralEconomics   publichealth ","['behavioraleconomics']",0,0,0,0,0,0,0,0,0,0,0,0,0,0,0,0,0,0,2020,10,16,"Fri"
83273,0.105520854291814,"Government Response","","God Father . Positive use Social Media . communication God since 2012 . owed expected . - Nietzsche",439,31,3597,"False",2020-11-03,"government care - contingent upon world accepting - refuse - be… ","[]",-0.1,0.6,0.05353535,0.3373737,"government care  contingent upon world accepting  refuse  be ","[]",0,0,0,0,0,0,0,0,0,0,0,0,0,0,0,0,0,0,2020,11,3,"Tue"
83313,0.139124516356698,"Government Response","In My Father's House There Are Many Rooms...","Pro Earth , Pro Human , Pro Child , Pro Nature",1959,4829,64885,"False",2020-10-21,"take # `` '' smart '' '' . # NANOBots","['CovidVaccine', 'NANOBots']",0.2142857,0.6428571,0,0.1,"take    smart     NANOBots","['nanobots']",0,0,0,0,0,0,0,0,0,0,0,0,0,0,0,0,0,0,2020,10,21,"Wed"
83509,0.145428286310706,"Gratitude and Optimism","Mumbai, India","Professional life , family & Rotary/social service co-exists harmoniously part daily life . Passionate everything love gardening , cooking .",157,339,115,"False",2020-10-14,"# @ Rotary @ RotaryBom @ RotaryClubWorli proud rotarian seen work polio immunization & ; su… ","['covidvaccine']",0.8,1,0.1375,0.3875,"  Rotary  RotaryBom  RotaryClubWorli proud rotarian seen work polio immunization   su ","['rotarybom']",0,0,0,0,0,0,0,0,0,0,0,0,0,0,0,0,0,0,2020,10,14,"Wed"
83573,0.144310328987899,"Government Response","St. Louis, Missouri","Elevating health healthcare designing # healthcaresupplychain solutions improve members ’ financial , operational clinical performance . # GPO",1972,412,1212,"False",2020-10-14,"# Amazon forms partnership improve temperature-sensitive distribution via @ BeckersHR… ","['Amazon']",0,0,0,0," Amazon forms partnership improve temperaturesensitive distribution via  BeckersHR ","['amazon', 'beckershr']",0,0,0,0,0,0,0,0,0,0,0,0,0,0,0,0,0,0,2020,10,14,"Wed"
83618,0.246711000603397,"Mask","Hubli, India","fix damaged / malfunctioning body parts mind help great engineer . Presently Chairman , Association surgeons India , Karnataka .",142,96,1156,"False",2020-10-11,"going adding blunders ? . Somewhere corner mind says ... # COVID… ","['COVID']",0,0,0.4,0.375,"going adding blunders   Somewhere corner mind says   COVID ","['covid']",0,0,0,1,0,0,0,0,0,0,0,0,0,0,0,0,0,0,2020,10,11,"Sun"
83992,0.132675269691884,"US government","Mumbai, India","independent research , ratings , tools helping people across investing ecosystem write financial futures .",8497,89,690,"False",2020-11-03,"“ People overhyping # . Unfortunately , political cycle talking metaphor… ","['COVIDvaccine']",0,0.1,0,0.0625," People overhyping   Unfortunately  political cycle talking metaphor ","[]",0,0,0,0,0,0,0,0,0,0,0,0,0,0,0,0,0,0,2020,11,3,"Tue"
84104,0.152149584455102,"US government","Bombay,India","Thank @ sudheenkulkarni @ sadhavi @ rahuleaswar @ pjkanojia @ tehseenp @ yashmeghwal @ hansrajmeena @ _garrywalia @ shafiburfat @ Shahid_Siddiqui @ Kappansky FB 🙏",6329,3028,47591,"False",2020-10-22,"# given # Biharis 1st ( know 's Jumlaa ) ? ? ? ? crime people of… ","['CovidVaccine', 'Biharis']",0,0,0,0," given  Biharis 1st  know s Jumlaa      crime people of ","[]",0,0,0,0,0,0,0,0,0,0,0,0,0,0,0,0,0,0,2020,10,22,"Thu"
84218,0.168501275867188,"Government Response","New Delhi, India","Official account DD India , English News TV Channel Doordarshan ( Prasar Bharati-India ’ Public Broadcaster ) Follow us ",34542,530,6982,"True",2020-11-05,"# Australia signed two deals Thursday buy 40 million doses # Novavax 10 million P… ","['Australia', 'CovidVaccine']",0,0,0,0.03333333," Australia signed two deals Thursday buy 40 million doses  Novavax 10 million P ","['australia']",0,1,0,0,0,0,0,0,0,0,0,0,0,0,0,0,0,0,2020,11,5,"Thu"
84391,0.146380419392328,"US government","Canada","Trauma-informed Therapy , Grief Therapy , Research & Evidence-Informed Education , Advocate People Living Disabilities , Human Rights Activist",2960,2975,2754,"False",2020-11-04,"Yeah Canada ! # Science # Antibodies # ","['Science', 'Antibodies', 'CovidVaccine']",0,0,-0.4,0.15,"Yeah Canada   Science  Antibodies  ","['canada science antibodies']",0,0,0,0,0,0,0,0,0,0,0,0,0,0,0,0,0,0,2020,11,4,"Wed"
84457,0.12501163400468,"US government","UK","Bemused boguś /V ( ) ews ! . . . . TOTALLY UNVERIFIED !",162,241,27,"False",2020-10-09,"@ 2primates @ RandPaul BTW perhaps help # PandemicParadox : real # COVID1984 ca n't produce… ","['PandemicParadox', 'COVID1984']",0.2,0.3,0,0.75," 2primates  RandPaul BTW perhaps help  PandemicParadox  real  COVID1984 ca nt produce ","['randpaul', 'pandemicparadox', 'covid1984']",0,0,0,0,0,0,0,0,0,0,0,0,0,0,0,0,0,0,2020,10,9,"Fri"
84468,0.126744385846898,"US government","Cénit. La Esfera Celeste","read learn Socialism Social Media , escaped & forever fight . Proud AMERICAN Naturalization.God bless USA # MAGA",1050,1646,17732,"False",2020-11-08,"poison- scam # cure # # ChinaVirus found ! Hallelujah ! ! ! ","['CovidVaccine', 'ChinaVirus']",0,0,0.2777778,0.3555556,"poison scam  cure   ChinaVirus found  Hallelujah    ","['chinavirus', 'hallelujah']",0,0,0,0,0,0,0,0,0,0,0,0,0,0,0,0,0,0,2020,11,8,"Sun"
84811,0.166004564556542,"Government Response","","Official channel",216,243,3370,"False",2020-10-14,"China National Biotec Group Co talks officials giving students headed abroad experimental vacc… ","[]",0.1,0.4,0,0,"China National Biotec Group Co talks officials giving students headed abroad experimental vacc ","['china', 'national biotec group co']",0,1,0,0,0,0,0,0,0,0,0,0,0,0,0,0,0,0,2020,10,14,"Wed"
84812,0.123758473702486,"Mask","","gal voice , heart views entirely . Champion wine sipper.🍷Loves reading good book two.📖 Insta blog : @ jenniferlarkestyle",35,143,641,"False",2020-10-18,"... need something look forward right ... # covid19ireland # # covid_19 # ","['covid19ireland', 'COVID', 'covid_19', 'CovidVaccine']",0.2857143,0.5357143,0.35,0.6125," need something look forward right   covid19ireland   covid19  ","[]",0,0,0,0,0,0,0,0,0,0,0,0,0,0,0,0,0,0,2020,10,18,"Sun"
85069,0.156061383243876,"Trial Results","London","n't distrust MSM , keep close eye everyone .",494,211,7899,"False",2020-10-12,"going `` '' , safe '' '' says Novavax 's Gregory Glenn # SkyNews 😂 . company received $ 1… ","['SkyNews']",0.5,0.5,0,0,"going    safe   says Novavax s Gregory Glenn  SkyNews   company received  1 ","['novavax', 'gregory glenn']",0,0,0,0,0,0,0,0,0,0,0,0,0,0,0,0,0,0,2020,10,12,"Mon"
85274,0.166645000046819,"Trial Results","Toronto, Ontario","provide ultimate healthcare solutions , supports mental physical well-being Canadians . 're # HR solution .",1001,1042,1484,"False",2020-10-16,"Canada begins review Oxford # candidate . Learn ! 👉  ( via @ globalnews ) … ","['CovidVaccine']",0,0,-0.03333333,0.447619,"Canada begins review Oxford  candidate  Learn     via  globalnews   ","['canada', 'oxford']",0,1,0,0,0,0,0,0,0,0,0,0,0,0,0,0,0,0,2020,10,16,"Fri"
85298,0.139287183488904,"Trial Results","United States","Twitter account Vaccinate Family ( former twitter handle @ ShotofPrev ) . discuss # people ages .",8551,2205,2100,"False",2020-11-05,"Rutgers researcher highlights need minority representation clinical trials  via… ","[]",0,0,0,0,"Rutgers researcher highlights need minority representation clinical trials  via ","[]",0,0,0,0,0,0,0,0,0,0,0,0,0,0,0,0,0,0,2020,11,5,"Thu"
85397,0.149501746093634,"US government","UK","Disorganised | Motherhood | Opinionated | Coffee Addict | Blessed",335,194,13180,"False",2020-10-20,"Government pay . , ’ sure ’ find way profit . # # ","['vaccines', 'CovidVaccine']",0.5,0.8888889,0,0,"Government pay    sure  find way profit    ","[]",0,0,0,0,0,0,0,0,0,0,0,0,0,0,0,0,0,0,2020,10,20,"Tue"
85481,0.105547680285427,"Education","New York State","Advocating increased patient access necessary prescription medications NYS . PhRMA-associated . Follow latest efforts : # PrescribeRealSolutions",1046,679,122,"False",2020-10-21,"Coming together fight : Find Albert Bourla using completely different approach finding a… ","[]",0,0.6,0.25,0.95,"Coming together fight  Find Albert Bourla using completely different approach finding a ","['find albert bourla']",0,0,0,0,0,0,0,0,0,0,0,0,0,0,0,0,0,0,2020,10,21,"Wed"
86041,0.140518208554547,"Education","51.443734,-0.129024","Lived London 20+ years . Please visit photography account portraitspinups",31,52,901,"False",2020-10-10,"spare 5 minutes , sign NHS Research Registry , ! # BePartofResearch… ","['BePartofResearch']",0,0,0,0,"spare 5 minutes  sign NHS Research Registry    BePartofResearch ","['nhs research registry']",0,0,0,0,0,0,0,0,0,0,0,0,0,0,0,0,0,0,2020,10,10,"Sat"
86066,0.131913301693461,"Case/Vaccination Statistics","Bendigo, Victoria, Oz","chief cook & bottle washer , agony aunt & magician , gardener & beach-comber , dreamer & doer , living dream",421,560,2885,"False",2020-11-05,"# 58 day 25 new cases Victoria deaths 6 days . # # NewNormal strength skinny s… ","['COVID19', 'NewNormal']",0.1363636,0.4545455,0,0," 58 day 25 new cases Victoria deaths 6 days    NewNormal strength skinny s ","['victoria', 'newnormal']",0,0,0,0,0,0,0,0,0,0,0,0,0,0,0,0,0,0,2020,11,5,"Thu"
86229,0.0911792498552148,"Mask","London, UK","Journalist , Broadcaster , Media/PR Consultant . Commentator , world citizen passion bringing # AfricanRenaissance 🌍Views .",6507,6068,11781,"False",2020-10-17,"2/2 @ kehinde_andrews # StephanieBloomberg # JulianWorricker , Sadly absent discussion though potent… ","['StephanieBloomberg', 'JulianWorricker']",-0.5,1,0,0,"22  kehindeandrews  StephanieBloomberg  JulianWorricker  Sadly absent discussion though potent ","['stephaniebloomberg']",0,0,0,0,0,0,0,0,0,0,0,0,0,0,0,0,0,0,2020,10,17,"Sat"
86514,0.137876643443699,"Education","Toronto, Ontario","provide ultimate healthcare solutions , supports mental physical well-being Canadians . 're # HR solution .",996,1042,1496,"False",2020-10-17,"Mike Sullivan CEO Co-Founder @ cubichealth , providing predictive analytics employee benefits in… ","[]",0,0,-0.03333333,0.447619,"Mike Sullivan CEO CoFounder  cubichealth  providing predictive analytics employee benefits in ","['mike', 'sullivan ceo']",0,0,0,0,0,0,0,0,0,0,0,0,0,0,0,0,0,0,2020,10,17,"Sat"
