"X","misinformation","user_location","user_description","user_followers","user_friends","user_favourites","user_verified","date","text","hashtags","polarity_text","subjectivity_text","polarity_description","subjectivity_description","cleaned_text","entities","Organizations","Locations","Symptoms","COVID","Vaccination","Politics","Conspiracy","Slurs","Masks","Miscellaneous","origin","vaccine_conspiracy","government","pharma","Five_G","gates","nwo","media"
32739,4.01298420344241e-09,"Kozhikode, Kerala","The online publication of Mathrubhumi was started on 5th September 1997. Now it publishes informative channels such as Entertainment, sports, health, education,",93502,7,10,"True",2020-10-15,"Russia approves 2nd virus vaccine after early trials https://t.co/tLGp5XDzP7 #covidvaccine","['covidvaccine']",0.05,0.15,0,0.5,"Russia approves 2nd virus vaccine after early trials  covidvaccine","['russia']",0,1,0,0,0,0,0,0,0,0,0,0,0,0,0,0,0,0
60942,5.94706598008306e-09,"Chennai","I am a GCTian,  thamizh Blogger since 2004. Interests: Cricket, Chess, Sujatha, J.Archer, DivyaPrabandham and of course political discourse :)",8049,790,28388,"False",2020-10-22,"https://t.co/kiz3QTPsXP 
This is most #unethical, illegal to make #covidvaccine a promise in the campaign or manife… https://t.co/BhjBVc6rQc","['unethical', 'covidvaccine']",0,0.5,0.25,0.55," 
This is most unethical illegal to make covidvaccine a promise in the campaign or manife ","[]",0,0,0,0,0,0,0,0,0,0,0,0,0,0,0,0,0,0
62134,0.136261533469707,"Valapady-Salem - Chennai","President INRLF , Vice President INTUC, Tamilnadu| Alumni CIT, ASU|Co Founder https://t.co/LDt3vHm4YY",742,1641,12524,"False",2020-10-22,"@Pawankhera BJP is Blackmailing voters with #CovidVaccine ,  Bihar voters should question BJP and their allies why… https://t.co/YMJa9qbtm4","['CovidVaccine']",0,0,0,0,"Pawankhera BJP is Blackmailing voters with CovidVaccine   Bihar voters should question BJP and their allies why ","['pawankhera', 'bjp', 'covidvaccine bihar', 'bjp']",0,0,0,0,0,0,0,0,0,0,0,0,0,0,0,0,0,0
80844,0.0419714048711305,"Nicosia","Editor-Journo @ Cyprus News Agency, views my own, RTs not endorsement, sarcasm is my middle name, honesty&intuition too!",4479,4930,8698,"False",2020-10-20,"#covid_19 What does it mean when a #CovidVaccine is in phase III? How many have been approved for limited use? Find… https://t.co/GIwtYWOLTv","['covid_19', 'CovidVaccine']",0.0386904761904762,0.443452380952381,0.3,0.5,"covid19 What does it mean when a CovidVaccine is in phase III How many have been approved for limited use Find ","['covidvaccine', 'iii']",0,0,0,0,1,0,0,0,0,0,0,0,0,0,0,0,0,0
99165,0.0632518502462766,"India","Political & Social Analyst. #IndiaFirst Privilege - PM @narendramodi ji follows me. All views are Strictly Personal. RTs are not endorsements #VandeMataram",8316,167,28444,"False",2020-11-08,"Russian sovereign wealth fund is reportedly saying will be labelled “Sputnik V” for international markets:

Russian… https://t.co/Xr8xz5UYTJ","[]",0,0,0.0111111111111111,0.155555555555556,"Russian sovereign wealth fund is reportedly saying will be labelled Sputnik V for international markets

Russian ","['russian', 'sputnik v', 'russian']",0,0,0,0,0,0,0,0,0,0,0,0,0,0,0,0,0,0
99908,0.0326778022470678,"Jamshedpur, India","I'm just a boy, standing in front of the world, asking you to follow me.

I am also srkian & msdian 😇",150,38,12681,"False",2020-11-08,"Breaking : #Russia released world's first #CovidVaccine.

#Putin said """"Russian health ministry has approved vaccine… https://t.co/8AoSJdEmWc","['Russia', 'CovidVaccine', 'Putin']",0.125,0.166666666666667,0,0,"Breaking  Russia released worlds first CovidVaccine

Putin said Russian health ministry has approved vaccine ","['russia', 'covidvaccine', 'putin', 'russian']",0,1,0,0,1,0,0,0,0,0,0,0,0,0,0,0,0,0
150,4.65242913896892e-09,"Washington, DC","Network Photojournalist at NBC Network News-Washington DC bureau. Passionate about Photography, Triathlons and Marathon Running (In no specific order).",272,310,848,"False",2020-10-13,"Johnson &amp; Johnson Temporarily Pauses All Dosing in Our Janssen COVID-19 Vaccine Candidate Clinical Trials after an… https://t.co/PmuOiWi1CH","[]",0,0,-0.025,0.4875,"Johnson amp Johnson Temporarily Pauses All Dosing in Our Janssen COVID19 Vaccine Candidate Clinical Trials after an ","['johnson', 'johnson temporarily', 'janssen covid19 vaccine candidate clinical trials']",0,0,0,0,0,1,0,0,0,0,0,0,0,0,0,0,0,0
168,0.0603045622827072,"Washington, DC","@Newsy Pentagon Reporter. Former @FoxNews SE Regional Reporter, @USAirForce Broadcaster/Anchor & D.C. @FoxNews Associate Producer. @SyracuseU Grad. God is #1",2961,1644,2532,"True",2020-10-16,"It's also available to all LTCF staff members who have not been vaccinated for COVID-19. #OperationWarpSpeed @Newsy… https://t.co/puIfMc21kr","['OperationWarpSpeed']",0.4,0.4,0,0,"Its also available to all LTCF staff members who have not been vaccinated for COVID19 OperationWarpSpeed Newsy ","['covid19']",0,0,0,1,0,0,0,0,0,0,0,0,0,0,0,0,0,0
338,0.0364147879804064,"North Carolina, USA","",3944,1561,1,"False",2020-10-14,"Bill Gates Says World Won’t Return to Normal Until “A Lot of People” Take a Second COVID Vaccine… https://t.co/lCqvtVNx5v","[]",0.075,0.325,0,0,"Bill Gates Says World Wont Return to Normal Until A Lot of People Take a Second COVID Vaccine ","['bill', 'gates says', 'normal', 'covid vaccine']",0,0,0,0,1,0,0,0,0,0,0,0,0,0,0,0,0,0
415,0.103880611946734,"london","columnist for https://t.co/ENon5VCZ03, former correspondent in moscow, paris, washington &, btw, not russian by birth or heritage. mod.langs @lmhoxford",1487,291,280,"False",2020-10-17,"don't join the establishment crowd of #russia-bashers @thetimes letters re #CovidVaccine (or anything else) w/out a… https://t.co/ozBrU3NdGt","['russia', 'CovidVaccine']",0,0,0,0,"dont join the establishment crowd of russiabashers thetimes letters re CovidVaccine or anything else wout a ","['covidvaccine']",0,0,0,0,1,0,0,0,0,0,0,0,0,0,0,0,0,0
547,0.0550057273335351,"Bristol, England","#Mum. Boy 10 yrs & Girl 4 years. WAS HR Manager & Yoga Teacher.  Now #pBlogger #SAHM #Vlogger  
https://t.co/AtmLXqiuCJ",9480,10099,91944,"False",2020-10-14,"500k sharks could be killed for vaccine ingredient via @RobertKennedyJr Instagram #Squalene #horseShoeCrabs… https://t.co/yXHNsfFQQt","['Squalene', 'horseShoeCrabs']",-0.2,0,0,0,"500k sharks could be killed for vaccine ingredient via RobertKennedyJr Instagram Squalene horseShoeCrabs ","['robertkennedyjr instagram squalene', 'horseshoecrabs']",0,0,0,0,0,0,0,0,0,0,0,0,0,0,0,0,0,0
673,0.00745886099553902,"Twitter","Proud Father and Husband. Vote!!",108,420,22758,"False",2020-10-10,"@NYGovCuomo #StaySafeStayHealthy everyone. 

Don’t get lazy. 

#StayHome as much as possible until we have a much b… https://t.co/rBx8Xc0Ofj","['StaySafeStayHealthy', 'StayHome']",-0.0166666666666667,0.733333333333333,1,1,"NYGovCuomo StaySafeStayHealthy everyone 

Dont get lazy 

StayHome as much as possible until we have a much b ","['nygovcuomo']",0,0,0,0,0,0,0,0,0,0,0,0,0,0,0,0,0,0
798,1.16090221405457e-09,"नई दिल्ली, भारत","Jesus Lover | Social Worker",244,1789,2619,"False",2020-10-22,"@BJP4India @nsitharaman @PMOIndia
As you have announced #Covidvaccine free, just a question?
When will covid vaccin… https://t.co/60VcLzB4Tg","['Covidvaccine']",0.4,0.8,0.0333333333333333,0.0666666666666667,"BJP4India nsitharaman PMOIndia
As you have announced Covidvaccine free just a question
When will covid vaccin ","['bjp4india', 'pmoindia', 'covidvaccine']",0,0,0,0,1,0,0,0,0,0,0,0,0,0,0,0,0,0
833,0.0366667859833955,"New Delhi, India","",12,85,1237,"False",2020-11-08,"#Russia #CovidVaccine
Russia announced first covid 19 vaccine.. Everyone to putin right now https://t.co/PysefX4otZ","['Russia', 'CovidVaccine']",0.267857142857143,0.43452380952381,0,0,"Russia CovidVaccine
Russia announced first covid 19 vaccine Everyone to putin right now ","['russia', 'covidvaccine russia']",0,1,0,0,0,0,0,0,0,0,0,0,0,0,0,0,0,0
966,2.22044604925031e-16,"Spain","With EU all the way! Campaigning for #citizensrights and #VotesForLife #HoldThemToAccount #StillEuropean",22150,16425,72052,"False",2020-10-13,"Johnson &amp; Johnson halts vaccine trial due to unexplained illness 
https://t.co/QC7vqyGKjK

#CovidVaccine","['CovidVaccine']",-0.0875,0.1875,0,0,"Johnson amp Johnson halts vaccine trial due to unexplained illness 


CovidVaccine","['johnson', 'johnson', 'covidvaccine']",0,0,0,0,1,2,0,0,0,0,0,0,0,0,0,0,0,0
1224,0.0398977767894439,"ਤੂੰ ਰਿਸ਼ਤਾ ਕਰਾਉਣਾ 🤪","☬ਮਨ👇🏻ਮੱਤ👆🏻☬
                            𝗥𝗝𝟭𝟯🏡
𝘞𝘌 𝘉𝘙𝘌𝘈𝘒🥊𝘉𝘖𝘕𝘌𝘚 𝘕𝘖𝘛 ♥️ 𝘏𝘌𝘈𝘙𝘛𝘚
@SidhuMooseWala🎧
          👻𝘚𝘪𝘥𝘩𝘶_𝘴13",11,18,137,"False",2020-11-08,"Russia launches world's first Covid-19 vaccine

Everyone's reaction 👇🏻

#RussianVaccine #CovidVaccine… https://t.co/H7v69Goup9","['RussianVaccine', 'CovidVaccine']",0.25,0.333333333333333,0,0,"Russia launches worlds first Covid19 vaccine

Everyones reaction 

RussianVaccine CovidVaccine ","['russia', 'covid19', 'russianvaccine']",0,1,0,1,0,0,0,0,0,0,0,0,0,0,0,0,0,0
1273,2.22044604925031e-16,"California","Wife to my amazing husband, teacher, photographer - Canadian living in tRump nightmare #VoteBlueToSaveAmerica 
#RestoreDemocracy",1956,4694,142429,"False",2020-10-16,"@thehill Biden plans to give FREE covid vaccines to ALL Americans. I'm with Biden all the way! #BidenHarris
#covidvaccine","['BidenHarris', 'covidvaccine']",0.5,0.8,0.6,0.9,"thehill Biden plans to give FREE covid vaccines to ALL Americans Im with Biden all the way BidenHarris
covidvaccine","['biden', 'free', 'all americans im', 'biden', 'bidenharris']",0,0,0,0,0,2,0,0,0,0,0,0,0,0,0,0,0,0
1332,0.0227785238748068,"","Breaking News, Bollywood, Latest Political News, National, Sports, Entertainment, Education, Technology & Daily Events
#CoronavirusVaccine",230,0,8218,"False",2020-11-08,"Russia becomes first country to register COVID-19 vaccine.

#CovidVaccine","['CovidVaccine']",0.25,0.333333333333333,0.166666666666667,0.333333333333333,"Russia becomes first country to register COVID19 vaccine

CovidVaccine","['russia', 'covid19', 'covidvaccine']",0,1,0,1,1,0,0,0,0,0,0,0,0,0,0,0,0,0
1361,0.0664269950977422,"Shanghai and Beijing","BBC camera journalist in China. Previously producing and shooting documentaries in Westminster. Any views are my own.",5024,5130,19632,"False",2020-10-17,"Hundreds queue in Yiwu, China for experimental Covid-19 vaccine #covid19 #china #CovidVaccine  https://t.co/GpmqwZZLDX","['covid19', 'china', 'CovidVaccine']",0.1,0.4,0.216666666666667,0.583333333333333,"Hundreds queue in Yiwu China for experimental Covid19 vaccine covid19 china CovidVaccine  ","['yiwu china']",0,0,0,0,0,0,0,0,0,0,0,0,0,0,0,0,0,0
1472,0.0391366602454212,"Mudeford, Dorset, UK","Husband | Father | Podcaster | Entrepreneur | CDP Nominating Officer ✝️ Views expressed here are my own. #ReadBetweenTheLies",501,174,2219,"False",2020-10-18,"Saw this today, it made me chuckle. #COVID19 #vaccines #CovidVaccine https://t.co/XrofnQdY7s","['COVID19', 'vaccines', 'CovidVaccine']",0,0,0.6,1,"Saw this today it made me chuckle COVID19 vaccines CovidVaccine ","['saw', 'covid19', 'covidvaccine']",0,0,0,1,1,0,0,0,0,0,0,0,0,0,0,0,0,0
1505,0.0618853613194513,"","sarcastic ❤",4,55,15,"False",2020-11-08,"Technically the world’s first #CovidVaccine is ready ! #RussianVaccine https://t.co/VPsyMRJLcd","['CovidVaccine', 'RussianVaccine']",0.166666666666667,0.311111111111111,0.1,0.8,"Technically the worlds first CovidVaccine is ready  RussianVaccine ","['covidvaccine']",0,0,0,0,1,0,0,0,0,0,0,0,0,0,0,0,0,0
1792,0.0412502543105323,"Melbourne, Australia","""""I have no mouth and I must scream"""" Ellison.
Screaming into the void. Is there anybody listening?",1602,2034,32099,"False",2020-10-20,"@SandraWeeden The #CovidVaccine is the exit strategy from the pandemic. Trouble is it's likely to be only 40%(ish)… https://t.co/hRwCpNVDsK","['CovidVaccine']",-0.0666666666666667,0.733333333333333,0,0,"SandraWeeden The CovidVaccine is the exit strategy from the pandemic Trouble is its likely to be only 40ish ","['covidvaccine', 'trouble']",0,0,0,0,1,0,0,0,0,0,0,0,0,0,0,0,0,0
1804,0.113233525417887,"Kerala, India","Student. 🇮🇳 Official Account. . I'm Twitterati. Stands for truth. 
https://t.co/pOyi9Snw0d
#BlackLivesMatter",634,1408,6302,"False",2020-10-20,"All should follow the guidelines issued by #government. 
We should #United2FightCorona.
#BREAKING #India #COVID19… https://t.co/oLF7jQDghB","['government', 'United2FightCorona', 'BREAKING', 'India', 'COVID19']",0,0,0,0,"All should follow the guidelines issued by government 
We should United2FightCorona
BREAKING India COVID19 ","['united2fightcorona', 'breaking india']",0,0,0,0,0,0,0,0,0,0,0,0,0,0,0,0,0,0
1997,0.0381191315029855,"Chicago, IL","Ann & Robert H. Lurie Children's Hospital of Chicago is ranked nationally in all 10 pediatric specialities by U.S. News & World Report. We Tweet for the kids.",22520,2754,2842,"False",2020-10-18,"Join Seema Shah, Associate Director of Research Ethics @LurieChildrens, for a free webinar hosted by… https://t.co/L78yWMHm5a","[]",0.4,0.8,0,0,"Join Seema Shah Associate Director of Research Ethics LurieChildrens for a free webinar hosted by ","['join', 'seema shah associate director', 'research ethics']",0,0,0,0,0,0,0,0,0,0,0,0,0,0,0,0,0,0
2241,0.0156750022961468,"Miami","Don't let the sun set on your promises 🦂🇳🇮🇸🇻🇧🇷🦋🏝⚽️",189,200,12160,"False",2020-10-09,"That #CovidVaccine is insane, I already have health problems and take Dr prescribed rx, these people don't know how… https://t.co/c17wsM0NAL","['CovidVaccine']",-1,1,0,0,"That CovidVaccine is insane I already have health problems and take Dr prescribed rx these people dont know how ","[]",0,0,0,0,0,0,0,0,0,0,0,0,0,0,0,0,0,0
2278,0.171308820984475,"Jaipur, India","so, I guess I make memes!! 🤷‍♂️🙋‍♂️",14,38,138,"False",2020-11-08,"#CoronaVaccine #CovidVaccine #RussianVaccine #Putin #COVID19 
Introverts, backbenchers, hand sanitizer companies an… https://t.co/TqibDJjiEY","['CoronaVaccine', 'CovidVaccine', 'RussianVaccine', 'Putin', 'COVID19']",0,0,0,0,"CoronaVaccine CovidVaccine RussianVaccine Putin COVID19 
Introverts backbenchers hand sanitizer companies an ","['coronavaccine', 'covidvaccine', 'putin covid19']",0,0,0,0,1,0,0,0,0,0,0,0,0,0,0,0,0,0
3440,0.168357848261717,"Odisha, India","When it comes to Breaking News, Kalinga TV leads the Way with 24x7 Coverage.",87344,178,469,"False",2020-10-17,"Covid Vaccine Sputnik V Gets Approval For Clinical Trials In India #COVID19Vic #COVID19 #CovidVaccine https://t.co/WEJnpKYkJu","['COVID19Vic', 'COVID19', 'CovidVaccine']",0,0,0,0,"Covid Vaccine Sputnik V Gets Approval For Clinical Trials In India COVID19Vic COVID19 CovidVaccine ","['covid', 'vaccine sputnik v gets approval', 'clinical trials in india', 'covid19vic']",0,0,0,1,1,0,0,0,0,0,0,0,0,0,0,0,0,0
3458,0.168357848261717,"","",0,0,0,"False",2020-11-08,"I wait #whatiwantedtosay #COVID19 #COVID19Aus #russia #CovidVaccine https://t.co/coHK5eOpkj","['whatiwantedtosay', 'COVID19', 'COVID19Aus', 'russia', 'CovidVaccine']",0,0,0,0,"I wait whatiwantedtosay COVID19 COVID19Aus russia CovidVaccine ","['covid19', 'covidvaccine']",0,0,0,1,1,0,0,0,0,0,0,0,0,0,0,0,0,0
3676,0.0668209088419267,"Baltimore, MD","@WMAR2News Reporter/Anchor • Investigative Journalist • Cat Enthusiast • Have a story idea/consumer issue? -- mallory@wmar.com #MatterForMallory",2814,2666,2116,"True",2020-10-20,"No vaccine yet, but @GovLarryHogan has released a draft plan for mass vaccinations in #Maryland. Those at highest r… https://t.co/Am4rcAFqB9","['Maryland']",0,0,0,0,"No vaccine yet but GovLarryHogan has released a draft plan for mass vaccinations in Maryland Those at highest r ","['govlarryhogan', 'maryland']",0,0,0,0,0,0,0,0,0,0,0,0,0,0,0,0,0,0
4050,0.141913209745827,"Planet Earth","",65,304,334,"False",2020-10-15,"The world just watched a 74 year old recover from #COVID19  in less than 7 days 
#CovidVaccine… https://t.co/KI8fox2pLG","['COVID19', 'CovidVaccine']",-0.0333333333333333,0.133333333333333,0,0,"The world just watched a 74 year old recover from COVID19  in less than 7 days 
CovidVaccine ","['covid19', 'covidvaccine']",0,0,0,1,1,0,0,0,0,0,0,0,0,0,0,0,0,0
4172,0.0185128050123709,"India","guntur",27,565,5859,"False",2020-11-08,"Russia becomes first country to approve a COVID-19 vaccine, says President Vladimir Putin https://t.co/m6hhrPKN4W…… https://t.co/6K7IwSxJhv","[]",0.25,0.333333333333333,0,0,"Russia becomes first country to approve a COVID19 vaccine says President Vladimir Putin  ","['russia', 'covid19', 'vladimir putin']",0,1,0,1,0,0,0,0,0,0,0,0,0,0,0,0,0,0
4359,0.0326778022470678,"Bhopal, India","!! वसुधैव कुटुम्बकम् !!",20,63,258,"False",2020-11-08,"#Russia released world's first #CovidVaccine.
#Putin said """"Russian health ministry has approved vaccine and my own… https://t.co/Nl227YkCLV","['Russia', 'CovidVaccine', 'Putin']",0.125,0.166666666666667,0,0,"Russia released worlds first CovidVaccine
Putin said Russian health ministry has approved vaccine and my own ","['russia', 'covidvaccine', 'putin', 'russian']",0,1,0,0,1,0,0,0,0,0,0,0,0,0,0,0,0,0
4640,0.0721634105430587,"United States","Twitter account of Vaccinate Your Family (former twitter handle was @ShotofPrev). We discuss #vaccines for people of all ages.",8536,2203,2053,"False",2020-10-13,"How the FDA plans to build physician trust for COVID-19 vaccine https://t.co/kdDQnBEbT7 (via @AmerMedicalAssn) 
--… https://t.co/SuM3ixy9FG","[]",0,0,0,0,"How the FDA plans to build physician trust for COVID19 vaccine  via AmerMedicalAssn 
 ","['fda', 'covid19', 'amermedicalassn']",1,0,0,1,0,0,0,0,0,0,0,0,0,0,0,0,0,0
4908,0.0404056834756532,"मुंबई, भारत","♡My Enigma Makes Me Special, Because it says I'm born to Love♡",81,26,130,"False",2020-10-22,"Treatment is Not Free Vaccine is Free 😂 Heights Of Brain😂
Aise kaise chalega Didi!!
#CovidVaccine #financeminister… https://t.co/w753syHQ0R","['CovidVaccine', 'financeminister']",0.2125,0.8,0.357142857142857,0.571428571428571,"Treatment is Not Free Vaccine is Free  Heights Of Brain
Aise kaise chalega Didi
CovidVaccine financeminister ","['treatment', 'free vaccine', 'free', 'brain aise', 'didi covidvaccine']",0,0,0,0,0,0,0,0,0,0,0,0,0,0,0,0,0,0
4925,0.197826821022487,"India","vivre l'instant présent",1,33,76,"False",2020-11-08,"Hope💙
#CovidVaccine #COVIDー19 #hopewell https://t.co/TfMBgyFPpO","['CovidVaccine', 'COVIDー19', 'hopewell']",0,0,0,0.666666666666667,"Hope
CovidVaccine COVID19 hopewell ","['hope', 'covidvaccine']",0,0,0,0,1,0,0,0,0,0,0,0,0,0,0,0,0,0
4968,0.0256657575303556,"Jaipur, India","Welcome to the Official Twitter page of First India Newspaper. Follow us for the latest updates. #FirstIndia",6180,208,98,"False",2020-10-20,"An experimental vaccine developed by China's #Sinovac Biotech appeared to be safe in providing protection against t… https://t.co/pYnMaQ9szB","['Sinovac']",0.233333333333333,0.4,0.516666666666667,0.711111111111111,"An experimental vaccine developed by Chinas Sinovac Biotech appeared to be safe in providing protection against t ","['chinas sinovac biotech']",0,0,0,0,0,0,0,0,0,0,0,0,0,0,0,0,0,0
5054,0.027907659705048,"South West, England","#NotBeingFunny #NiceCow #Bristol #Somerset #Dorset I am EUropean and used to be way more popular than this!",299,319,4186,"False",2020-10-10,"How about a #CovidVaccine first, then we'll worry about bloody #Wales!
'Real and imminent' extinction risk to whales
https://t.co/7cxYDOs2oX","['CovidVaccine', 'Wales']",-0.183333333333333,0.511111111111111,0.416666666666667,0.466666666666667,"How about a CovidVaccine first then well worry about bloody Wales
Real and imminent extinction risk to whales
","['covidvaccine', 'wales real']",0,0,0,0,1,0,0,0,0,0,0,0,0,0,0,0,0,0
5081,0.0329600400476414,"NYC","classic",100,705,71,"False",2020-11-08,"Worlds first vaccine in Russia given to Putin's daughter #RussianVaccine #CovidVaccine @NewsClapper… https://t.co/1W8rtWUOxE","['RussianVaccine', 'CovidVaccine']",0.25,0.333333333333333,0.166666666666667,0.166666666666667,"Worlds first vaccine in Russia given to Putins daughter RussianVaccine CovidVaccine NewsClapper ","['russia', 'putins', 'russianvaccine']",0,1,0,0,0,0,0,0,0,0,0,0,0,0,0,0,0,0
5272,0.0384807638531343,"Hyderabad, India","IG~@eskge",19,1,9,"False",2020-11-08,"Happiest person in the world after knowing someone from Moscow developed the Covid Vaccine. #RussianVaccine… https://t.co/3XBz5Jjmrp","['RussianVaccine']",0.1,0.3,0,0,"Happiest person in the world after knowing someone from Moscow developed the Covid Vaccine RussianVaccine ","['happiest', 'moscow', 'covid vaccine']",0,0,0,0,1,0,0,0,0,0,0,0,0,0,0,0,0,0
5513,0.0322002186494669,"Chennai, India","Moto Doctor🏍️⚕️",5,82,126,"False",2020-11-08,"Big Breaking : #Russia released world's first #CovidVaccine.

#Putin said """"Russian health ministry has approved vac… https://t.co/jadrXFSEnj","['Russia', 'CovidVaccine', 'Putin']",0.0833333333333333,0.144444444444444,0,0,"Big Breaking  Russia released worlds first CovidVaccine

Putin said Russian health ministry has approved vac ","['russia', 'covidvaccine', 'putin', 'russian']",0,1,0,0,1,0,0,0,0,0,0,0,0,0,0,0,0,0
5690,5.09246505337519e-08,"India","MIRROR NOW's Mission: Demand accountability and relentlessly drive improvement by addressing everyday issues. Follow us on Instagram - @mirrornow_in",87847,30,2,"True",2020-10-22,"At 8:40PM on #TheUrbanDebate with @tanvishukla 

5 big questions on the #COVIDVaccine plan 

#COVID19 #Covid_19… https://t.co/JCWESnOyi6","['TheUrbanDebate', 'COVIDVaccine', 'COVID19', 'Covid_19']",0,0.1,-0.2,0.6,"At 840PM on TheUrbanDebate with tanvishukla 

5 big questions on the COVIDVaccine plan 

COVID19 Covid19 ","['covidvaccine', 'covid19 covid19']",0,0,0,0,1,0,0,0,0,0,0,0,0,0,0,0,0,0
5857,0.123658152741844,"India","India's NEWS Channel for Digital Media!
To get in touch with us, send a Direct Message",1086,179,280,"False",2020-10-15,"Headlines by the indian national daily - 15 Oct 

#CovidVaccine #GSTCouncil #ZojilaTunnel #DelhiPollution… https://t.co/mUCHgjT9W4","['CovidVaccine', 'GSTCouncil', 'ZojilaTunnel', 'DelhiPollution']",0,0,0.05,0.2,"Headlines by the indian national daily  15 Oct 

CovidVaccine GSTCouncil ZojilaTunnel DelhiPollution ","['gstcouncil']",0,0,0,0,0,0,0,0,0,0,0,0,0,0,0,0,0,0
6479,0.0203893074379007,"","❤ We need to learn to Love eachother, Listen to eachother and follow eachother eventhough we 100% disagree on everything 🏴‍☠️",69506,196,612,"False",2020-11-08,"World leaders talking to #Putin after hearing that #Russia Has Developed world's First #CovidVaccine! 😂😂😂😂

#Corona… https://t.co/ipiW2SUkPT","['Putin', 'Russia', 'CovidVaccine', 'Corona']",0.20625,0.316666666666667,0.5,0.6,"World leaders talking to Putin after hearing that Russia Has Developed worlds First CovidVaccine 

Corona ","['world', 'putin', 'russia', 'first covidvaccine corona']",0,1,0,0,0,0,0,0,0,0,0,0,0,0,0,0,0,0
6552,4.33098773813537e-09,"New Delhi, India","Conspicuous scar mark on right eyebrow. Perpetual cardamom tea consumer. Live and let live.
I am politically incorrect. I tell the truth and use common sense.",54,51,531,"False",2020-10-22,"Waking up to discover that the #covidvaccine has been politicised in the upcoming #BiharElections2020. Seriously, s… https://t.co/w9wJEFE6In","['covidvaccine', 'BiharElections2020']",-0.333333333333333,0.666666666666667,0.0516883116883117,0.427142857142857,"Waking up to discover that the covidvaccine has been politicised in the upcoming BiharElections2020 Seriously s ","['biharelections2020 seriously']",0,0,0,0,0,0,0,0,0,0,0,0,0,0,0,0,0,0
6815,0.0130398072353274,"Matrix","HE | Twitter Rapper 🎼 | Satirst | Liberal | 🐕 Pet Parent | Centrist | ಕನ್ನಡಿಗ | ❌ Hatred/Bigotry/Racism/Casteism| Centrist | RT & 👍 Likes, not Endorsement |",666,2302,3692,"False",2020-10-18,"Is #India ready to deliver a vaccine to a billion people?

#CovidVaccine 
#COVID19 
#coronavirus 

Great article 👏👏… https://t.co/JftjoEzDfp","['India', 'CovidVaccine', 'COVID19', 'coronavirus']",0.5,0.625,0,0,"Is India ready to deliver a vaccine to a billion people

CovidVaccine 
COVID19 
coronavirus 

Great article  ","['india', 'covidvaccine', 'great']",0,1,0,0,1,0,0,0,0,0,0,0,0,0,0,0,0,0
6829,0.0565399470335535,"Somewhere under the sun.","Nt a gud boi bur gat loyalty. | Chelsea 💙| Football | Realist. | Versatile. | Music | Follower of Followers. ❤️",1451,1509,3713,"False",2020-11-08,"Now we can all laugh and cough as we like. Russia is here for us.😁#CovidVaccine","['CovidVaccine']",0.3,0.1,0,0,"Now we can all laugh and cough as we like Russia is here for usCovidVaccine","['russia', 'uscovidvaccine']",0,1,0,0,0,0,0,0,0,0,0,0,0,0,0,0,0,0
7235,0.029415065016767,"India","🌎WRITER
.
.
.
.
.
.
.
.
.





//

Getting to know the self in me more;
tranna be better everyday💙.",6,10,46,"False",2020-11-08,"#CovidVaccine finally reported.
Sigh of relief for many people and nations across the globe🌎
#RussianVaccine… https://t.co/nx0N7vQWNn","['CovidVaccine', 'RussianVaccine']",0.25,0.75,0.5,0.5,"CovidVaccine finally reported
Sigh of relief for many people and nations across the globe
RussianVaccine ","['covidvaccine', 'russianvaccine']",0,0,0,0,1,0,0,0,0,0,0,0,0,0,0,0,0,0
